id,title,description,url,class,provider,columns,frequency,updated,contact,contact_phone
134,臺灣觀光夜市美食街衛生自主管理與輔導資料集,本資料集提供民國100年至102年「臺灣觀光夜市美食街衛生自主管理與輔導資料」，提供一般民眾參考使用。惟103年起未辦理觀光夜市美食街之輔導計畫，故本資料集將不再新增資料。,http://data.fda.gov.tw/frontsite/data/DataAction.do?method=doDetail&infoId=134,食品,食品組,年度、區域、觀光夜市名稱或美食街名稱、店家名稱、供餐型式,不定期,2015/02/05,呂先生,02-2787-7366
135,輸入食品管理暨輸入查驗統計年報出版品資料集,本資料集提供輸入食品管理暨輸入查驗統計年報出版品連結，藉此提供學術單位、業者、民眾等使用者使用。,http://data.fda.gov.tw/frontsite/data/DataAction.do?method=doDetail&infoId=135,食品,食品組,標題、連結,每一年,2017/08/23,陳小姐,02-2787-7329
136,罕見疾病藥物年報,本資料集提供罕見疾病藥物資料庫系統的藥物年報，藉此提供學術單位、業者、民眾等使用者使用。,http://data.fda.gov.tw/frontsite/data/DataAction.do?method=doDetail&infoId=136,藥品,藥品組,藥物年報名稱、檔案下載連結、目錄連結,每一年,2017/08/23,黃小姐,02-2787-7441
137,各年度各國食品輸入重量前10名資料集,本資料集提供各年度各國食品輸入重量前10名，藉此提供學術單位、業者、民眾等使用者使用。,http://data.fda.gov.tw/frontsite/data/DataAction.do?method=doDetail&infoId=137,食品,北區管理中心,年度、排名、國別、輸入重量,每一年,2017/08/23,沈先生,2787-8379
138,各年度輸入重量前10名之中分類產品資料集,本資料集提供各年度輸入重量10名之中分類產品，藉此提供學術單位、業者、民眾等使用者使用。,http://data.fda.gov.tw/frontsite/data/DataAction.do?method=doDetail&infoId=138,食品,北區管理中心,年度、排名、產品中分類、輸入重量公噸、佔總輸入重量百分比,每一年,2017/08/23,沈先生,2787-8379
139,各年度輸入食品各中分類產品檢驗結果資料集,本資料集提供各年度輸入食品各中分類產品檢驗結果，藉此提供學術單位、業者、民眾等使用者使用。,http://data.fda.gov.tw/frontsite/data/DataAction.do?method=doDetail&infoId=139,食品,北區管理中心,年度、產品中分類、查驗批數、檢驗批數、檢驗批數比例、不符合批數、不符合批數比例,每一年,2017/10/03,沈先生,2787-8379
140,各年度輸入食品各檢驗項目檢驗結果資料集,本資料集提供各年度輸入食品各檢驗項目檢驗結果，藉此提供學術單位、業者、民眾等使用者使用。,http://data.fda.gov.tw/frontsite/data/DataAction.do?method=doDetail&infoId=140,食品,北區管理中心,年度、檢驗項目、檢驗批數、不合格批數、不合格率一、不合格率二,每一年,2017/08/23,沈先生,2787-8379
141,日本輸入食品輻射抽驗結果資料集,本資料集介接TFDA署網「最新食品輻射監測專區」資料連結，並藉此提供學術單位、業者、民眾等使用者使用。,http://data.fda.gov.tw/frontsite/data/DataAction.do?method=doDetail&infoId=141,食品,北區管理中心,標題、連結、發布日期,不定期,2017/12/07,詹先生,02-2787-8393
142,管制藥品分級及品項資料集,本資料集提供食品藥物管理署認可之管制藥品分級及品項資料，藉此提供學術單位、業者、民眾等使用者使用。,http://data.fda.gov.tw/frontsite/data/DataAction.do?method=doDetail&infoId=142,管制藥品,管制藥品組,標題、連結,不定期,2017/09/21,萬先生,2787-7667
143,管制藥品管理相關法規資料集,食品藥物管理署依職掌權責公告訂定管制藥品管理相關法律規範，包含法律、標準、辦法、指引、要點、函釋…等。,http://data.fda.gov.tw/frontsite/data/DataAction.do?method=doDetail&infoId=143,管制藥品,管制藥品組,標題、連結、更新日期,每月,2017/11/10,王先生,02-2787-7617
144,衛生福利部食品藥物管理署預算書資料集,衛生福利部食品藥物管理署單位預算、衛生福利部食品藥物管理署附屬單位預算。,http://data.fda.gov.tw/frontsite/data/DataAction.do?method=doDetail&infoId=144,其他,主計室,標題、發布日期、連結,每一年,2017/09/19,吳小姐,02-2787-7963
145,衛生福利部食品藥物管理署決算書資料集,衛生福利部食品藥物管理署單位決算、衛生福利部食品藥物管理署附屬單位決算。,http://data.fda.gov.tw/frontsite/data/DataAction.do?method=doDetail&infoId=145,其他,主計室,標題、發布日期、連結,每一年,2017/08/24,吳小姐,02-2787-7963
146,化粧品不合格產品名單資料集,本資料集為「化粧品不合格產品名單」資料，並與署網同步更新，藉此提供學術單位、業者、民眾等使用者進一步使用。,http://data.fda.gov.tw/frontsite/data/DataAction.do?method=doDetail&infoId=146,化粧品,醫療器材及化粧品組,產品品名、批號、廠商名稱、品質檢驗判定結果,不定期,2015/03/25,楊小姐,02-2787-7591
147,市售食品中殘留動物用藥監測結果資料集,本資料集提供市售食品中殘留動物用藥監測結果，藉此提供學術單位、業者、民眾等使用者使用。,http://data.fda.gov.tw/frontsite/data/DataAction.do?method=doDetail&infoId=147,食品,中區管理中心,年度月份、抽樣衛生局、檢體名稱、抽驗廠商、檢出項目及殘留容許量,不定期,2017/11/02,陳先生,04-2369-2440
148,市售食品中真菌毒素汙染監測計畫檢驗結果資料集,本資料集提供市售食品中真菌毒素汙染監測計畫檢驗結果，藉此提供學術單位、業者、民眾等使用者使用。,http://data.fda.gov.tw/frontsite/data/DataAction.do?method=doDetail&infoId=148,食品,北區管理中心,年度、檢體名稱、抽驗廠商名稱、抽驗廠商地址、有效日期、產地、真菌毒素檢出量及其限量標準、發布日期,不定期,2015/04/01,陳先生,03-850-9021
149,食米中重金屬含量監測檢驗結果資料集,本資料集提供食米中重金屬含量監測檢驗結果，藉此提供學術單位、業者、民眾等使用者使用。,http://data.fda.gov.tw/frontsite/data/DataAction.do?method=doDetail&infoId=149,食品,北區管理中心,年度、檢體名稱、抽樣廠商名稱、抽樣廠商地址、產地、重金屬檢測殘留量鎘含量_單位ppm、重金屬檢測殘留量汞含量_單位ppm、重金屬檢測殘留量鉛含量_單位ppm、檢驗結果,每一年,2017/11/08,吳先生,02-2787-8339
150,塑膠類食品器具容器包裝宣導資訊資料集,本資料集提供署網的塑膠類食品器具容器包裝宣傳海報，藉此提供學術單位、業者、民眾等使用者使用。,http://data.fda.gov.tw/frontsite/data/DataAction.do?method=doDetail&infoId=150,食品,食品組,標題、發布日期、連結,每月,2017/12/02,林先生,02-2787-7365
151,塑膠類食品器具容器包裝歷年檢驗結果資料集,本資料集提供署網的塑膠類食品容器具包裝歷年檢驗結果，藉此提供學術單位、業者、民眾等使用者使用。,http://data.fda.gov.tw/frontsite/data/DataAction.do?method=doDetail&infoId=151,食品,食品組,標題、發布日期、連結,每一年,2017/04/12,林先生,02-2787-7365
152,醫療器材安全警訊資料集,本資料集提供醫療器材安全警訊資料，藉此提供學術單位、業者、民眾等使用者使用。,http://data.fda.gov.tw/frontsite/data/DataAction.do?method=doDetail&infoId=152,醫療器材,醫療器材及化粧品組,標題、連結、發布日期,不定期,2017/12/01,周先生,02-2787-7519
156,違規藥品廣告資料集,本資料集擷取自各縣市衛生局登錄之藥品廣告處辦紀錄，可顯示欄位以系統開放者為限，惟本資料集可能因後續修正裁量而有所變動，亦不代表處分主體之產品為違法，請審慎採參。,http://data.fda.gov.tw/frontsite/data/DataAction.do?method=doDetail&infoId=156,藥品,企劃及科技管理組,違規產品名稱、違規廠商名稱或負責人、處分機關、處分日期、處分法條、違規情節、刊播日期、刊播媒體類別、刊播媒體、查處情形,每週,2017/11/30,陳先生,02-2787-7248
157,違規醫療器材廣告資料集,本資料集擷取自各縣市衛生局登錄之醫療器材廣告處辦紀錄，可顯示欄位以系統開放者為限，惟本資料集可能因後續修正裁量而有所變動，亦不代表處分主體之產品為違法，請審慎採參。,http://data.fda.gov.tw/frontsite/data/DataAction.do?method=doDetail&infoId=157,醫療器材,企劃及科技管理組,違規產品名稱、違規廠商名稱或負責人、處分機關、處分日期、處分法條、違規情節、刊播日期、刊播媒體類別、刊播媒體、查處情形,每週,2017/11/30,陳先生,02-2787-7248
158,違規化粧品廣告資料集,本資料集擷取自各縣市衛生局登錄之化粧品廣告處辦紀錄，可顯示欄位以系統開放者為限，惟本資料集可能因後續修正裁量而有所變動，亦不代表處分主體之產品為違法，請審慎採參。,http://data.fda.gov.tw/frontsite/data/DataAction.do?method=doDetail&infoId=158,化粧品,企劃及科技管理組,違規產品名稱、違規廠商名稱或負責人、處分機關、處分日期、處分法條、違規情節、刊播日期、刊播媒體類別、刊播媒體、查處情形,每週,2017/11/30,陳先生,02-2787-7248
159,食藥闢謠專區資料集,本資料集介接TFDA署網「食藥闢謠專區」資料連結，並藉此提供一般民眾等相關網路謠言澄清。,http://data.fda.gov.tw/frontsite/data/DataAction.do?method=doDetail&infoId=159,其他,企劃及科技管理組,分類、標題、內容、附檔連結、發布日期,不定期,2017/12/12,郭先生,02-2787-7255
160,衛生福利部食品藥物管理署會計月報資料集,本資料集介接TFDA署網的政府資訊公開「會計月報」，並藉此提供學術單位、業者、民眾等使用者使用。,http://data.fda.gov.tw/frontsite/data/DataAction.do?method=doDetail&infoId=160,其他,主計室,標題、發布日期、連結,每月,2017/11/13,吳小姐,02-2787-7963
161,食品廣告標示諮議會委員名單資料集,本資料集提供食品廣告標示諮議會委員名單，藉此提供學術單位、業者、民眾等使用者使用。,http://data.fda.gov.tw/frontsite/data/DataAction.do?method=doDetail&infoId=161,食品,企劃及科技管理組,年份、委員姓名、性別、專長、備註,不定期,2015/08/13,吳小姐,02-2787-7247
162,食品檢驗方法諮議會委員名單資料集,本資料集提供食品檢驗方法諮議會委員名單，藉此提供學術單位、業者、民眾等使用者使用。,http://data.fda.gov.tw/frontsite/data/DataAction.do?method=doDetail&infoId=162,研究檢驗,研究檢驗組,年份、職稱、姓名、性別、專長,不定期,2015/08/13,徐小姐,02-2787-7718
163,食品檢驗機構認證審議小組委員名單資料集,本資料集提供食品檢驗機構認證審議小組委員名單，藉此提供學術單位、業者、民眾等使用者使用。,http://data.fda.gov.tw/frontsite/data/DataAction.do?method=doDetail&infoId=163,實驗室認證,風險管理組,年份、職稱、姓名、性別、專長,不定期,2017/08/29,陳先生,02-2787-7126
164,濫用藥物尿液檢驗機構認可實地評鑑委員名單資料集,本資料集提供濫用藥物尿液檢驗機構認可實地評鑑委員名單，藉此提供學術單位、業者、民眾等使用者使用。,http://data.fda.gov.tw/frontsite/data/DataAction.do?method=doDetail&infoId=164,實驗室認證,風險管理組,年份、現職單位職稱、姓名、性別、備註,不定期,2017/02/24,吳小姐,02-2787-7128
165,濫用藥物尿液檢驗機構認可審議委員會委員名單資料集,本資料集提供濫用藥物尿液檢驗機構認可審議委員會委員名單，藉此提供學術單位、業者、民眾等使用者使用。,http://data.fda.gov.tw/frontsite/data/DataAction.do?method=doDetail&infoId=165,實驗室認證,風險管理組,年份、現職單位職稱、姓名、性別、備註,不定期,2017/02/24,吳小姐,02-2787-7128
166,藥物化粧品檢驗機構認證審議小組委員名單資料集,本資料集提供藥物化粧品檢驗機構認證審議小組委員名單，藉此提供學術單位、業者、民眾等使用者使用。,http://data.fda.gov.tw/frontsite/data/DataAction.do?method=doDetail&infoId=166,實驗室認證,風險管理組,年份、職稱、姓名、性別、專長,不定期,2017/08/29,楊先生,02-2787-7154
167,藥物非臨床試驗GLP認證審議小組委員名單資料集,本資料集提供藥物非臨床試驗GLP認證審議小組委員名單，藉此提供學術單位、業者、民眾等使用者使用。,http://data.fda.gov.tw/frontsite/data/DataAction.do?method=doDetail&infoId=167,實驗室認證,風險管理組,年份、職稱、姓名、性別、專長,不定期,2017/08/29,王先生,02-2787-7128
168,食品衛生安全與營養諮議會委員名單資料集,本資料集提供食品衛生安全與營養諮議會委員名單，藉此提供學術單位、業者、民眾等使用者使用。,http://data.fda.gov.tw/frontsite/data/DataAction.do?method=doDetail&infoId=168,食品,食品組,年份、職稱、姓名、性別、專長,不定期,2015/08/13,王小姐,02-2787-7319
169,健康食品及膠囊錠狀食品非預期反應諮議小組委員名單資料集,本資料集提供健康食品及膠囊錠狀食品非預期反應諮議小組委員名單，藉此提供學術單位、業者、民眾等使用者使用。,http://data.fda.gov.tw/frontsite/data/DataAction.do?method=doDetail&infoId=169,食品,食品組,年份、職稱、姓名、性別、專長,不定期,2015/08/26,王小姐,02-2787-7337
170,健康食品審議小組委員名單資料集,本資料集提供健康食品審議小組委員名單，藉此提供學術單位、業者、民眾等使用者使用。,http://data.fda.gov.tw/frontsite/data/DataAction.do?method=doDetail&infoId=170,食品,食品組,年份、職稱、姓名、性別、專長,不定期,2015/08/13,江先生,02-2787-7332
171,基因改造食品審議小組委員名單資料集,本資料集提供基因改造食品審議小組委員名單，藉此提供學術單位、業者、民眾等使用者使用。,http://data.fda.gov.tw/frontsite/data/DataAction.do?method=doDetail&infoId=171,食品,食品組,年份、職稱、姓名、性別、專長,不定期,2015/08/13,陳小姐,02-2787-7335
172,基因改造食品諮議會委員名單資料集,本資料集提供基因改造食品諮議會委員名單，藉此提供學術單位、業者、民眾等使用者使用。,http://data.fda.gov.tw/frontsite/data/DataAction.do?method=doDetail&infoId=172,食品,食品組,年份、職稱、姓名、性別、專長,不定期,2015/08/13,陳小姐,02-2787-7335
173,農藥殘留容許量標準_外源性農藥殘留容許量標準,正面表列規定外源性農藥殘留容許量標準。,http://data.fda.gov.tw/frontsite/data/DataAction.do?method=doDetail&infoId=173,食品,食品組,國際普通名稱、普通名稱、作物類別、容許量ppm、備註,不定期,2015/08/13,王小姐,02-2787-7319
174,醫療器材安全評估諮議會委員名單資料集,本資料集提供醫療器材安全評估諮議會委員名單，藉此提供學術單位、業者、民眾等使用者使用。,http://data.fda.gov.tw/frontsite/data/DataAction.do?method=doDetail&infoId=174,醫療器材,醫療器材及化粧品組,年份、職稱、姓名、性別、專長,不定期,2015/08/13,周先生,02-2787-7519
175,醫療器材諮議會委員名單資料集,本資料集提供醫療器材諮議會委員名單，藉此提供學術單位、業者、民眾等使用者使用。,http://data.fda.gov.tw/frontsite/data/DataAction.do?method=doDetail&infoId=175,醫療器材,醫療器材及化粧品組,年份、職稱、姓名、性別、專長,不定期,2017/01/03,李小姐,02-2787-7538
176,再生醫學諮議小組委員名單資料集,本資料集提供再生醫學諮議小組委員名單，藉此提供學術單位、業者、民眾等使用者使用。,http://data.fda.gov.tw/frontsite/data/DataAction.do?method=doDetail&infoId=176,藥品,藥品組,年份、姓名、性別、專長、備註,不定期,2015/08/13,趙先生,02-2787-7492
177,指示藥品及成藥諮議小組委員名單資料集,本資料集提供指示藥品及成藥諮議小組委員名單，藉此提供學術單位、業者、民眾等使用者使用。,http://data.fda.gov.tw/frontsite/data/DataAction.do?method=doDetail&infoId=177,藥品,藥品組,年份、性別、姓名、專長、備註,不定期,2016/07/25,王小姐,02-2787-7435
178,國產原料藥諮議小組委員名單資料集,本資料集提供國產原料藥諮議小組委員名單，藉此提供學術單位、業者、民眾等使用者使用。,http://data.fda.gov.tw/frontsite/data/DataAction.do?method=doDetail&infoId=178,藥品,藥品組,年份、職稱、姓名、性別、專長,不定期,2015/08/13,廖小姐,02-2787-7438
179,提昇藥事服務品質諮議小組委員名單資料集,本資料集提供提昇藥事服務品質諮議小組委員名單，藉此提供學術單位、業者、民眾等使用者使用。,http://data.fda.gov.tw/frontsite/data/DataAction.do?method=doDetail&infoId=179,藥品,藥品組,年份、職稱、姓名、性別、服務單位及職稱,不定期,2015/08/13,王小姐,02-2787-7408
180,藥品安全評估諮議小組委員名單資料集,本資料集提供藥品安全評估諮議小組委員名單，藉此提供學術單位、業者、民眾等使用者使用。,http://data.fda.gov.tw/frontsite/data/DataAction.do?method=doDetail&infoId=180,藥品,藥品組,年份、職稱、姓名、性別、專長、備註,不定期,2015/08/13,楊先生,02-2787-7413
181,藥品諮議小組委員名單資料集,本資料集提供藥品諮議小組委員名單，藉此提供學術單位、業者、民眾等使用者使用。,http://data.fda.gov.tw/frontsite/data/DataAction.do?method=doDetail&infoId=181,藥品,藥品組,年份、姓名、專長、備註,不定期,2015/08/13,王先生,02-2787-7478
182,藥害救濟審議委員會委員名單資料集,本資料集提供藥害救濟審議委員會委員名單，藉此提供學術單位、業者、民眾等使用者使用。,http://data.fda.gov.tw/frontsite/data/DataAction.do?method=doDetail&infoId=182,藥品,藥品組,年份、姓名、專長、備註,不定期,2015/08/13,楊先生,02-2787-7413
188,食品追溯追蹤系統消費者查詢資料集,本資料集提供食品追溯追蹤系統網站資料，可顯示欄位以該系統開放者為限，惟該系統(即本資料集)刊登之產品相關介紹資料及檢驗報告，係由該負責廠商自主提供，相關權責回歸負責廠商，本署不擔保其正確性，如涉及違反食品標示、宣傳或廣告等，有不實、誇張或易生誤解之規定時，將由轄區衛生主管機關依食品安全衛生管理法逕行裁處。使用本資料集時請審慎採參。,http://data.fda.gov.tw/frontsite/data/DataAction.do?method=doDetail&infoId=188,食品,食品組,產品分類、公司名稱、產品名稱、包裝規格、產品追溯系統串接碼、警語、特色、產品圖片有效起始日、正面外包裝照片、反面外包裝照片、側面外包裝照片、有效起始日、每一份量、本包裝含、每份熱量、每份蛋白質、每份脂肪、每份飽和脂肪、每份反式脂肪、每份碳水化合物、每份糖、每份鈉、每100公克熱量、每100公克蛋白質、每100公克脂肪、每100公克飽和脂肪、每100公克反式脂肪、每100公克碳水化合物、每100公克糖、每100公克鈉、每100毫升熱量、每100毫升蛋白質、每100毫升脂肪、每100毫升飽和脂肪、每100毫升反式脂肪、每100毫升碳水化合物、每100毫升糖、每100毫升鈉、每日參考值熱量、每日參考值蛋白質、每日參考值脂肪、每日參考值飽和脂肪、每日參考值反式脂肪、每日參考值碳水化合物、每日參考值糖、每日參考值鈉、營養標示圖片、內容物標示、內容物標示圖片、送樣或檢驗日期、檢驗項目、檢驗報告一、檢驗報告二、檢驗報告三,每週,2017/12/07,余先生,02-2787-7338
189,"符合PIC/S GDP藥商名單資料集","本資料集為食品藥物管理署稽核國內PIC/S GDP藥商之名單，本資料集同步署網更新，藉此提供消費者、業者或從事醫療人員進一步使用。",http://data.fda.gov.tw/frontsite/data/DataAction.do?method=doDetail&infoId=189,風險管理,風險管理組,藥商別、藥商名稱、藥商地址、GDP作業內容,不定期,2017/12/06,李先生/小姐,02-27877030
190,食藥好文網懶人包集合資料集,本資料集介接本署食藥好文網「懶人包大集合」資料，並藉此提供民眾快速了解相關網路議題。,http://data.fda.gov.tw/frontsite/data/DataAction.do?method=doDetail&infoId=190,其他,企劃及科技管理組,文章標題、分類、內容、上架時間,不定期,2017/10/29,張小姐,02-2787-7257
191,衛生福利部食品藥物管理署公務預算補助案件資料集,衛生福利部食品藥物管理署公款補助情形季報表,http://data.fda.gov.tw/frontsite/data/DataAction.do?method=doDetail&infoId=191,其他,主計室,標題、發布日期、連結網址,每3個月,2017/11/20,張小姐,02-2787-7959
192,二級品管驗證通過之食品業者名單資料集,本資料集為依食品安全衛生管理法第八條第五項規定，取得食品衛生安全管理系統驗證(二級品管驗證)之食品業者名單，本資料同步於食藥署官網及FACS驗證系統，藉此提供消費者、業者及相關人員進一步使用。,http://data.fda.gov.tw/frontsite/data/DataAction.do?method=doDetail&infoId=192,食品,風險管理組,工廠或製造場所名稱、工廠或製造場所地址、工廠登記編號、食品業者登錄字號、驗證業別、驗證效期,不定期,2017/11/26,尤小姐,02-2787-7153
193,衛生福利部食品藥物管理署基金預算補助案件資料集,衛生福利部食品藥物管理署基金補捐助情形季報表。,http://data.fda.gov.tw/frontsite/data/DataAction.do?method=doDetail&infoId=193,其他,主計室,標題、發布日期、連結網址,每3個月,2017/10/27,吳小姐,02-2787-7963
