紅燈	葡萄牙發布消費警訊，原產地剛果民主共和國Caro品牌之Caro Light - Lightening Beauty Cream化粧品，成分表中含有hydroquinone藥品成分而禁止通關乙事	<p style="text-align: justify; text-justify: inter-ideograph; 18pt: ;"><span style="font-family: 標楷體; color: black;">◎</span><span style="font-family: 標楷體; color: black;">葡萄牙發布消費警訊，原</span><span style="font-family: 標楷體;">產地剛果民主共和國</span>Caro<span style="font-family: 標楷體;">品牌之</span><span style="font-family: 標楷體;">Caro Light - Lightening Beauty Cream</span><span style="font-family: 標楷體;">化粧品</span><span style="font-family: 標楷體; color: black;">，批號：</span>Batch number L8B069163<span style="font-family: 標楷體;">，成分表中含有</span>hydroquinone<span style="font-family: 標楷體;">藥品成分，</span><span style="font-family: 標楷體; color: black;">可能對人體產生危害。</span> </p><p style="text-align: justify; text-justify: inter-ideograph; punctuation-wrap: simple; 18pt: ;"><span style="font-family: 標楷體; color: black;">◎</span><span style="color: black;"> Hydroquinone</span><span style="font-family: 標楷體; color: black;">為藥品成分，</span><span style="font-family: 標楷體; color: black;">衛生福利部</span><span style="font-family: 標楷體; color: black;">未核准可添加在化粧品中，如違法添加係違反藥事法之規定，可處十年以下有期徒刑，並得併科新台幣</span><span style="color: black;">1</span><span style="font-family: 標楷體; color: black;">千萬以下罰金。</span> </p><p style="text-align: justify; text-justify: inter-ideograph; punctuation-wrap: simple; 18pt: ;">&nbsp;</p><p style="text-align: justify; text-justify: inter-ideograph; 18pt: ;"><span style="font-family: 標楷體; color: black;">◎</span><span style="font-family: 標楷體; color: black;">衛生福利部</span><span style="font-family: 標楷體; color: black;">並未核准該產品進口販售，呼籲消費者不要</span><span style="font-family: 標楷體;">自網路或其他通路商購買該產品使用</span><span style="font-family: 標楷體; color: black;">。</span> </p><p style="text-align: justify; text-justify: inter-ideograph; 18pt: ;">&nbsp;</p><span style="font-size: 12pt; font-family: 標楷體; color: black;">◎ </span><span style="font-size: 12pt; font-family: 標楷體;">為強化化粧品管理及取締不法，</span><span style="font-size: 12pt; font-family: 標楷體; color: black;">衛生福利部</span><span style="font-size: 12pt; font-family: 標楷體;">歡迎全國民眾共同協同監督不法情事，並設置為民服務電子信箱：</span><span style="font-size: 12pt; font-family: times new roman, serif;"><a href="http://faq.fda.gov.tw/Message/Default.aspx" title="http://faq.fda.gov.tw/Message/Default.aspx"><span style="color: #0000ff;">http://faq.fda.gov.tw/Message/Default.aspx</span></a></span><span style="font-size: 12pt; font-family: 標楷體;">及</span><span style="font-size: 12pt; font-family: 標楷體;">消保服務專線</span><span style="font-size: 12pt; font-family: times new roman, serif;">02-2787-8200</span><span style="font-size: 12pt; font-family: 標楷體;">，以供民眾檢舉及諮詢。民眾如因購用之化粧品發現有不良品或不良反應發生時，可通報</span><span style="font-size: 12pt; font-family: 標楷體; color: black;">衛生福利部</span><span style="font-size: 12pt; font-family: 標楷體;">所建置「全國化粧品不良品通報系統」，網址：</span><span style="font-size: 12pt; font-family: times new roman, serif;"><a href="http://cosmetic-recall.fda.gov.tw/" title="http://cosmetic-recall.fda.gov.tw"><span style="color: #0000ff;">http://cosmetic-recall.fda.gov.tw</span></a></span><span style="font-size: 12pt; font-family: 標楷體; color: black;">，通報專線：</span><span style="font-size: 12pt; font-family: times new roman, serif; color: black;">02-2358-7343</span><span style="font-size: 12pt; font-family: 標楷體; color: black;">。</span>	<span style="font-size: 12pt; font-family: 標楷體;">為維護消費者健康與權益，呼籲消費者，勿自國外、網路或其他通路商購買該產品使用。</span>		2014-08-15	
紅燈	葡萄牙發布消費警訊，原產地剛果民主共和國Caro品牌之Caro Light - Lightening oil化粧品，成分表中含有hydroquinone藥品成分而禁止通關乙事	<p style="text-align: justify; text-justify: inter-ideograph; 18pt: ;"><span style="font-family: 標楷體; color: black;">◎</span><span style="font-family: 標楷體; color: black;">葡萄牙發布消費警訊，原</span><span style="font-family: 標楷體;">產地剛果民主共和國</span>Caro<span style="font-family: 標楷體;">品牌之</span>Caro Light - Lightening oil<span style="font-family: 標楷體;">化粧品</span><span style="font-family: 標楷體; color: black;">，批號：</span><span style="font-family: 標楷體;">Batch number: L5B92778; Expiration and manufacturing dates: - F:12/13; - E:12/15.</span><span style="font-family: 標楷體;">，成分表中含有</span>hydroquinone<span style="font-family: 標楷體;">藥品成分乙事</span><span style="font-family: 標楷體; color: black;">可能對人體產生危害。</span> </p><p style="text-align: justify; text-justify: inter-ideograph; punctuation-wrap: simple; 18pt: ;"><span style="font-family: 標楷體; color: black;">◎</span><span style="color: black;"> Hydroquinone</span><span style="font-family: 標楷體; color: black;">為藥品成分，</span><span style="font-family: 標楷體; color: black;">衛生福利部</span><span style="font-family: 標楷體; color: black;">未核准可添加在化粧品中，如違法添加係違反藥事法之規定，可處十年以下有期徒刑，並得併科新台幣</span><span style="color: black;">1</span><span style="font-family: 標楷體; color: black;">千萬以下罰金。</span> </p><p style="text-align: justify; text-justify: inter-ideograph; punctuation-wrap: simple; 18pt: ;">&nbsp;</p><p style="text-align: justify; text-justify: inter-ideograph; 18pt: ;"><span style="font-family: 標楷體; color: black;">◎</span><span style="font-family: 標楷體; color: black;">衛生福利部</span><span style="font-family: 標楷體; color: black;">並未核准該產品進口販售，呼籲消費者不要</span><span style="font-family: 標楷體;">自網路或其他通路商購買該產品使用</span><span style="font-family: 標楷體; color: black;">。</span> </p><p style="text-align: justify; text-justify: inter-ideograph; 18pt: ;">&nbsp;</p><span style="font-size: 12pt; font-family: 標楷體; color: black;">◎ </span><span style="font-size: 12pt; font-family: 標楷體;">為強化化粧品管理及取締不法，</span><span style="font-size: 12pt; font-family: 標楷體; color: black;">衛生福利部</span><span style="font-size: 12pt; font-family: 標楷體;">歡迎全國民眾共同協同監督不法情事，並設置為民服務電子信箱：</span><span style="font-size: 12pt; font-family: times new roman, serif;"><a href="http://faq.fda.gov.tw/Message/Default.aspx" title="http://faq.fda.gov.tw/Message/Default.aspx"><span style="color: #0000ff;">http://faq.fda.gov.tw/Message/Default.aspx</span></a></span><span style="font-size: 12pt; font-family: 標楷體;">及</span><span style="font-size: 12pt; font-family: 標楷體;">消保服務專線</span><span style="font-size: 12pt; font-family: times new roman, serif;">02-2787-8200</span><span style="font-size: 12pt; font-family: 標楷體;">，以供民眾檢舉及諮詢。民眾如因購用之化粧品發現有不良品或不良反應發生時，可通報</span><span style="font-size: 12pt; font-family: 標楷體; color: black;">衛生福利部</span><span style="font-size: 12pt; font-family: 標楷體;">所建置「全國化粧品不良品通報系統」，網址：</span><span style="font-size: 12pt; font-family: times new roman, serif;"><a href="http://cosmetic-recall.fda.gov.tw/" title="http://cosmetic-recall.fda.gov.tw"><span style="color: #0000ff;">http://cosmetic-recall.fda.gov.tw</span></a></span><span style="font-size: 12pt; font-family: 標楷體; color: black;">，通報專線：</span><span style="font-size: 12pt; font-family: times new roman, serif; color: black;">02-2358-7343</span><span style="font-size: 12pt; font-family: 標楷體; color: black;">。</span>	<span style="font-size: 12pt; font-family: 標楷體;">為維護消費者健康與權益，呼籲消費者，勿自國外、網路或其他通路商購買該產品使用。</span>		2014-08-15	
紅燈	有關中國大陸發布消費警訊，原產地義大利艾婕芙專業美容化妝品集團之「RVB淨采海藻體膜2500g」化粧品，含鉛超標乙事	<pre style="background: white; text-align: justify; margin-left: 16.7pt; text-justify: inter-ideograph;"><span style="font-family: 標楷體;">◎</span><span style="font-family: 標楷體;">中國大陸質檢總局發布消費警訊，原產地義大利艾婕芙專業美容化妝品集團之「RVB淨采海藻體膜2500g」化粧品，</span><span style="font-family: 標楷體;">因含重金屬鉛</span><span style="font-family: 標楷體;">超標</span><span style="font-family: 標楷體;">，具化學性危害，可能影響人體健康</span><span style="font-family: 細明體;"><span style="color: black;">。</span> <br /></span><strong><span style="font-family: 標楷體; font-weight: normal;">◎</span></strong><span style="font-family: 標楷體;">按「鉛」是為重金屬，經人體吸收後，會影響人體健康，為確保消費者健康，我國化粧品衛生管理法令規定不得擅自添加鉛及其化合物於化粧品中，違反者，依化粧品衛生管理條例可處一年以下有期徒刑、拘役或科或併科新台幣十五萬元以下罰金。</span> <br /><strong><span style="font-size: 12pt; font-family: 標楷體; font-weight: normal;">◎</span></strong><span style="font-size: 12pt; font-family: 標楷體;">為強化化粧品管理及取締不法，</span><span style="font-size: 12pt; font-family: 標楷體; color: black;">衛生福利部</span><span style="font-size: 12pt; font-family: 標楷體;">歡迎全國民眾共同協同監督不法情事，並設置為民服務電子信箱：</span><span style="font-size: 12pt; font-family: times new roman, serif;"><a href="http://faq.fda.gov.tw/Message/Default.aspx" title="http://faq.fda.gov.tw/Message/Default.aspx"><span style="color: #0000ff;">http://faq.fda.gov.tw/Message/Default.aspx</span></a></span><span style="font-size: 12pt; font-family: 標楷體;">及</span><span style="font-size: 12pt; font-family: 標楷體;">消保服務專線</span><span style="font-size: 12pt; font-family: times new roman, serif;">02-2787-8200</span><span style="font-size: 12pt; font-family: 標楷體;">，以供民眾檢舉及諮詢。民眾如因購用之化粧品發現有不良品或不良反應發生時，可通報</span><span style="font-size: 12pt; font-family: 標楷體; color: black;">衛生福利部</span><span style="font-size: 12pt; font-family: 標楷體;">所建置「全國化粧品不良品通報系統」，網址：</span><span style="font-size: 12pt; font-family: times new roman, serif;"><a href="http://cosmetic-recall.fda.gov.tw/" title="http://cosmetic-recall.fda.gov.tw"><span style="color: #0000ff;">http://cosmetic-recall.fda.gov.tw</span></a></span><span style="font-size: 12pt; font-family: 標楷體; color: black;">，通報專線：</span><span style="font-size: 12pt; font-family: times new roman, serif; color: black;">02-2358-7343</span><span style="font-size: 12pt; font-family: 標楷體; color: black;">。</span></pre>	<span style="font-size: 12pt; font-family: 標楷體;">為確保民眾之健康與權益，</span><span style="font-size: 12pt; font-family: 標楷體;">衛生福利部</span><span style="font-size: 12pt; font-family: 標楷體;">呼籲消費者，切勿自行由國外、網路或其他通路商購買該產品使用。</span>		2014-09-15	
紅燈	歐盟（荷蘭）發布消費警訊，象牙海岸Skin Light品牌之Skin lightening product「Skin Light with carrot extract and vitamin E」化粧品，含有Hydroquinone藥品成分乙事	<p style="text-align: justify; text-justify: inter-ideograph; 18pt: ;"><span style="font-family: 標楷體; color: #000000;">◎ </span><span style="font-family: 標楷體; color: #000000;">荷蘭</span><span style="font-family: 標楷體; color: #000000;">發布消費警訊，象牙海岸</span><span style="color: #000000;">Skin Light</span><span style="font-family: 標楷體; color: #000000;">品牌之</span><span style="color: #000000;">Skin lightening product</span><span style="font-family: 標楷體; color: #000000;">「</span><span style="color: #000000;">Skin Light with carrot extract and vitamin E</span><span style="font-family: 標楷體; color: #000000;">」化粧品</span><span style="font-family: 標楷體; color: #000000;">，批號：</span>Lot. CSL D15; FAB 03/04/2013; EXP 04/2016; NAFDAC 02-6435<span style="font-family: 標楷體;">，</span><span style="font-family: 標楷體; color: #000000;">因含有</span><span style="color: #000000;">Hydroquinone</span><span style="font-family: 標楷體; color: #000000;">藥品成分，可能對人體產生危害。</span> </p><p style="text-align: justify; text-justify: inter-ideograph; punctuation-wrap: simple; 18pt: ;"><span style="font-family: 標楷體; color: #000000;">◎</span><span style="color: #000000;"> Hydroquinone</span><span style="font-family: 標楷體; color: #000000;">為藥品成分，衛生福利部未核准可添加在化粧品中，如違法添加係違反藥事法之規定，可處十年以下有期徒刑，並得併科新台幣</span><span style="color: #000000;">1</span><span style="font-family: 標楷體; color: #000000;">千萬以下罰金。</span> </p><p style="text-align: justify; text-justify: inter-ideograph; 18pt: ;"><span style="font-family: 標楷體; color: #000000;">◎</span> <span style="font-family: 標楷體; color: #000000;">衛生福利部並未核准該產品進口販售，呼籲消費者不要</span><span style="font-family: 標楷體;">自網路或其他通路商購買該產品使用</span><span style="font-family: 標楷體; color: #000000;">。</span> </p><span style="font-size: 12pt; font-family: 標楷體; color: #000000;">◎ </span><span style="font-size: 12pt; font-family: 標楷體;">為強化化粧品管理及取締不法，衛生福利部歡迎全國民眾共同協同監督不法情事，並設置為民服務電子信箱：</span><span style="font-size: 12pt; font-family: times new roman, serif;"><a href="http://faq.fda.gov.tw/Message/Default.aspx" title="http://faq.fda.gov.tw/Message/Default.aspx"><span style="color: #0000ff;">http://faq.fda.gov.tw/Message/Default.aspx</span></a></span><span style="font-size: 12pt; font-family: 標楷體;">及消保服務專線</span><span style="font-size: 12pt; font-family: times new roman, serif;">02-2787-8200</span><span style="font-size: 12pt; font-family: 標楷體;">，以供民眾檢舉及諮詢。民眾如因購用之化粧品發現有不良品或不良反應發生時，可通報衛生福利部所建置「全國化粧品不良品通報系統」，網址：</span><span style="font-size: 12pt; font-family: times new roman, serif;"><a href="http://cosmetic-recall.fda.gov.tw/" title="http://cosmetic-recall.fda.gov.tw"><span style="color: #0000ff;">http://cosmetic-recall.fda.gov.tw</span></a></span><span style="font-size: 12pt; font-family: 標楷體;">，通報專線：</span><span style="font-size: 12pt; font-family: times new roman, serif;">02-2396-0100</span><span style="font-size: 12pt; font-family: 標楷體;">。</span>	<span style="font-size: 12pt; font-family: 標楷體;">為維護消費者健康與權益，衛生福利部呼籲消費者，勿自國外、網路或其他通路商購買該產品使用。</span>		2014-09-29	
紅燈	歐盟（荷蘭）發布消費警訊，象牙海岸ClairLiss品牌之Skin lightening product「Clair Liss Génial toning body lotion with vitamin E」化粧品，含有Hydroquinone藥品成分乙事	<p style="text-align: justify; text-justify: inter-ideograph; 18pt: ;"><span style="font-family: 標楷體; color: #000000;">◎ </span><span style="font-family: 標楷體; color: #000000;">荷蘭</span><span style="font-family: 標楷體; color: #000000;">發布消費警訊，</span><span style="font-family: 標楷體; color: #000000;">象牙海岸</span><span style="color: #000000;">ClairLiss</span><span style="font-family: 標楷體; color: #000000;">品牌之</span><span style="color: #000000;">Skin lightening product</span><span style="font-family: 標楷體; color: #000000;">「</span><span style="color: #000000;">Clair Liss G</span><span style="font-family: 標楷體; color: #000000;">&eacute;</span><span style="color: #000000;">nial toning body lotion with vitamin E</span><span style="font-family: 標楷體; color: #000000;">」化粧品</span><span style="font-family: 標楷體; color: #000000;">，</span><span style="color: #000000;">Type/number of model: Ean 6181100 320329</span><span style="font-family: 新細明體, serif; color: #000000;">，</span><span style="font-family: 標楷體; color: #000000;">批號：</span>Lot 2 3 60; FAB 10/12; EX 10/14<span style="font-family: 標楷體;">，</span><span style="font-family: 標楷體; color: #000000;">因含有</span><span style="color: #000000;">Hydroquinone</span><span style="font-family: 標楷體; color: #000000;">藥品成分，可能對人體產生危害。</span> </p><p style="text-align: justify; text-justify: inter-ideograph; punctuation-wrap: simple; 18pt: ;"><span style="font-family: 標楷體; color: #000000;">◎</span><span style="color: #000000;"> Hydroquinone</span><span style="font-family: 標楷體; color: #000000;">為藥品成分，衛生福利部未核准可添加在化粧品中，如違法添加係違反藥事法之規定，可處十年以下有期徒刑，並得併科新台幣</span><span style="color: #000000;">1</span><span style="font-family: 標楷體; color: #000000;">千萬以下罰金。</span> </p><p style="text-align: justify; text-justify: inter-ideograph; punctuation-wrap: simple; 18pt: ;">&nbsp;</p><p style="text-align: justify; text-justify: inter-ideograph; 18pt: ;"><span style="font-family: 標楷體; color: #000000;">◎</span> <span style="font-family: 標楷體; color: #000000;">衛生福利部並未核准該產品進口販售，呼籲消費者不要</span><span style="font-family: 標楷體;">自網路或其他通路商購買該產品使用</span><span style="font-family: 標楷體; color: #000000;">。</span> </p><p style="text-align: justify; text-justify: inter-ideograph; 18pt: ;">&nbsp;</p><span style="font-size: 12pt; font-family: 標楷體; color: #000000;">◎</span><span style="font-size: 12pt; font-family: 標楷體;">為強化化粧品管理及取締不法，衛生福利部歡迎全國民眾共同協同監督不法情事，並設置為民服務電子信箱：</span><span style="font-size: 12pt; font-family: times new roman, serif;"><a href="http://faq.fda.gov.tw/Message/Default.aspx" title="http://faq.fda.gov.tw/Message/Default.aspx"><span style="color: #0000ff;">http://faq.fda.gov.tw/Message/Default.aspx</span></a></span><span style="font-size: 12pt; font-family: 標楷體;">及消保服務專線</span><span style="font-size: 12pt; font-family: times new roman, serif;">02-2787-8200</span><span style="font-size: 12pt; font-family: 標楷體;">，以供民眾檢舉及諮詢。民眾如因購用之化粧品發現有不良品或不良反應發生時，可通報衛生福利部所建置「全國化粧品不良品通報系統」，網址：</span><span style="font-size: 12pt; font-family: times new roman, serif;"><a href="http://cosmetic-recall.fda.gov.tw/" title="http://cosmetic-recall.fda.gov.tw"><span style="color: #0000ff;">http://cosmetic-recall.fda.gov.tw</span></a></span><span style="font-size: 12pt; font-family: 標楷體;">，通報專線：</span><span style="font-size: 12pt; font-family: times new roman, serif;">02-2396-0100</span><span style="font-size: 12pt; font-family: 標楷體;">。</span>	<span style="font-size: 12pt; font-family: 標楷體;">為維護消費者健康與權益，衛生福利部呼籲消費者，勿自國外、網路或其他通路商購買該產品使用。</span>		2014-09-29	
紅燈	歐盟（荷蘭）發布消費警訊，英國Crusader品牌之Skin lightening product「Skin toning cream」化粧品，含有Hydroquinone藥品成分乙事	<p style="text-align: justify; text-justify: inter-ideograph; 18pt: ;"><span style="font-family: 標楷體; color: black;">◎ </span><span style="font-family: 標楷體; color: black;">荷蘭</span><span style="font-family: 標楷體; color: black;">發布消費警訊，</span><span style="font-family: 標楷體; color: black;">英國</span><span style="color: black;">Crusader</span><span style="font-family: 標楷體; color: black;">品牌之</span><span style="color: black;">Skin lightening product</span><span style="font-family: 標楷體; color: black;">「</span><span style="color: black;">Skin toning cream</span><span style="font-family: 標楷體; color: black;">」化粧品</span><span style="font-family: 標楷體; color: black;">，</span><span style="color: black;">Type/number of model: EAN 5021699 000008</span><span style="font-family: 新細明體, serif; color: black;">，</span><span style="font-family: 標楷體; color: black;">批號：</span>lot 121925, 2017<span style="font-family: 標楷體;">，</span><span style="font-family: 標楷體; color: black;">因含有</span><span style="color: black;">Hydroquinone</span><span style="font-family: 標楷體; color: black;">藥品成分，可能對人體產生危害。</span> </p><p style="text-align: justify; text-justify: inter-ideograph; punctuation-wrap: simple; 18pt: ;"><span style="font-family: 標楷體; color: black;">◎</span><span style="color: black;"> Hydroquinone</span><span style="font-family: 標楷體; color: black;">為藥品成分，衛生福利部未核准可添加在化粧品中，如違法添加係違反藥事法之規定，可處十年以下有期徒刑，並得併科新台幣</span><span style="color: black;">1</span><span style="font-family: 標楷體; color: black;">千萬以下罰金。</span> </p><p style="text-align: justify; text-justify: inter-ideograph; punctuation-wrap: simple; 18pt: ;">&nbsp;</p><p style="text-align: justify; text-justify: inter-ideograph; 18pt: ;"><span style="font-family: 標楷體; color: black;">◎</span> <span style="font-family: 標楷體; color: black;">衛生福利部並未核准該產品進口販售，呼籲消費者不要</span><span style="font-family: 標楷體;">自網路或其他通路商購買該產品使用</span><span style="font-family: 標楷體; color: black;">。</span> </p><p style="text-align: justify; text-justify: inter-ideograph; 18pt: ;">&nbsp;</p><span style="font-size: 12pt; font-family: 標楷體; color: black;">◎</span><span style="font-size: 12pt; font-family: 標楷體;">為強化化粧品管理及取締不法，衛生福利部歡迎全國民眾共同協同監督不法情事，並設置為民服務電子信箱：</span><span style="font-size: 12pt; font-family: times new roman, serif;"><a href="http://faq.fda.gov.tw/Message/Default.aspx" title="http://faq.fda.gov.tw/Message/Default.aspx"><span style="color: #0000ff;">http://faq.fda.gov.tw/Message/Default.aspx</span></a></span><span style="font-size: 12pt; font-family: 標楷體;">及消保服務專線</span><span style="font-size: 12pt; font-family: times new roman, serif;">02-2787-8200</span><span style="font-size: 12pt; font-family: 標楷體;">，以供民眾檢舉及諮詢。民眾如因購用之化粧品發現有不良品或不良反應發生時，可通報衛生福利部所建置「全國化粧品不良品通報系統」，網址：</span><span style="font-size: 12pt; font-family: times new roman, serif;"><a href="http://cosmetic-recall.fda.gov.tw/" title="http://cosmetic-recall.fda.gov.tw"><span style="color: #0000ff;">http://cosmetic-recall.fda.gov.tw</span></a></span><span style="font-size: 12pt; font-family: 標楷體;">，通報專線：</span><span style="font-size: 12pt; font-family: times new roman, serif;">02-2396-0100</span><span style="font-size: 12pt; font-family: 標楷體;">。</span>	<span style="font-size: 12pt; font-family: 標楷體;">為維護消費者健康與權益，衛生福利部呼籲消費者，勿自國外、網路或其他通路商購買該產品使用。</span>		2014-09-29	
