紅燈	有關奧地利發布消費警訊，原產地德國之「Kartoffel "Erdäpfel" Spezial Crème - special potato cream (Skin cream)」化粧品遭微生物污染乙事	<p>◎奧地利發布消費警訊，原產地德國之「Kartoffel "Erd&auml;pfel" Spezial Cr&egrave;me - special potato cream (Skin cream)」，批號：2208，含高含量Pseudomonas aeruginosa (up to 13 000 kbE/g)、含量超過標準的aerobic mesophilic bacteria 及高含量enterobacteria，具為生物性危害，可能影響人體健康。</p><p>◎為確保化粧品之品質及消費者之使用安全，衛生署已於94年9月間公告訂定「化粧品中微生物容許量基準」，規範生菌數容許量如下：（1）嬰兒用、眼部周圍用及使用於接觸黏膜部位之化粧品必須在100 CFU/g或mL以下。（2）其他類化粧品必須在1000 CFU/g或mL以下。且不得檢出大腸桿菌（Escherichia coli）、綠膿桿菌（Pseudomonas aeruginosa）或金黃色葡萄球菌（Staphylococcus aureus）等。</p><p>◎為強化化粧品管理及取締不法，衛生署歡迎全國民眾共同協同監督不法情事，並設置為民服務電子信箱：<a href="http://faq.fda.gov.tw/Message/Default.aspx" title="http://faq.fda.gov.tw/Message/Default.aspx">http://faq.fda.gov.tw/Message/Default.aspx</a>及消保服務專線02-2787-8200，以供民眾檢舉及諮詢。民眾如因購用之化粧品發現有不良品或不良反應發生時，可通報衛生署所建置「全國化粧品不良品通報系統」，網址：<a href="http://cosmetic-recall.fda.gov.tw" title="http://cosmetic-recall.fda.gov.tw">http://cosmetic-recall.fda.gov.tw</a>，通報專線：02-2396-0100。<br></br><br></br></p>	<span style="color: rgb(0, 0, 0); font-family: 標楷體; font-size: 12pt; mso-ascii-font-family: &quot;times new roman&quot;; mso-bidi-font-family: &quot;times new roman&quot;; mso-font-kerning: 1.0pt; mso-ansi-language: en-us; mso-fareast-language: zh-tw; mso-bidi-language: ar-sa;">為維護消費者健康與權益，衛生署呼籲消費者，勿自行由國外、網路或其他通路商購買該產品使用。</span>		2013-03-08	
紅燈	歐盟（斯洛伐克）發布消費警訊，原產地中國Ua Te Long品牌之「Eye/Lip Liner Pencil (Eye/Lip Liner)」化粧品遭重金屬污染乙事	<p>◎斯洛伐克發布消費警訊，原產地中國Ua Te Long品牌之「Eye/Lip Liner Pencil (Eye/Lip Liner)」化粧品，批號：8592548296752，因該產品粉紅色含鉛173.1 mg/kg，黑色含鉛 2.49 mg/kg，具化學性危害，可能影響人體健康。</p><p>◎按「鉛」是為重金屬，經人體吸收後，會影響人體健康，為確保消費者健康，我國化粧品衛生管理法令規定不得擅自添加鉛及其化合物於化粧品中，違反者，依化粧品衛生管理條例可處一年以下有期徒刑、拘役或科或併科新台幣十五萬元以下罰金。</p><p>◎為強化化粧品管理及取締不法，衛生署歡迎全國民眾共同協同監督不法情事，並設置為民服務電子信箱：<a href="http://faq.fda.gov.tw/Message/Default.aspx" title="http://faq.fda.gov.tw/Message/Default.aspx">http://faq.fda.gov.tw/Message/Default.aspx</a>及消保服務專線02-2787-8200，以供民眾檢舉及諮詢。民眾如因購用之化粧品發現有不良品或不良反應發生時，可通報衛生署所建置「全國化粧品不良品通報系統」，網址：<a href="http://cosmetic-recall.fda.gov.tw" title="http://cosmetic-recall.fda.gov.tw">http://cosmetic-recall.fda.gov.tw</a>，通報專線：02-2396-0100。<br></br></p>	<span style="font-family: 標楷體; font-size: 12pt; mso-ascii-font-family: &quot;times new roman&quot;; mso-bidi-font-family: &quot;times new roman&quot;; mso-font-kerning: 1.0pt; mso-ansi-language: en-us; mso-fareast-language: zh-tw; mso-bidi-language: ar-sa;">為維護消費者健康與權益，衛生署呼籲消費者，勿自行由國外、網路或其他通路商購買該產品使用。</span>		2013-03-08	
紅燈	有關歐盟發布訊息，印度Moon Star廠製造之Herbal henna - Moon Star Herbal Henna black化粧品含「p-Phenylenediamine (PPD)」染髮劑成分5.3%而回收乙事：	◎印度Moon Star廠製造之Herbal henna - Moon Star Herbal Henna black化粧品，Type/number of model: 8906003771027，p-Phenylenediamine (PPD)」染髮劑成分5.3%，故回收此產品。 ◎衛生署為保障消費者之健康與權益，對染髮劑成分「對苯二胺 (p-Phenylenediamine) (PPD)」，有限量規定，不得超出4%。凡染髮劑，依化粧品衛生管理條例規定，需辦理含藥化粧品查驗登記，領得許可證後方可輸入或製造，違反者，依化粧品衛生管理條例可處一年以下有期徒刑、拘役或科或併科新台幣十五萬元以下罰金。 ◎衛生署呼籲消費者勿自行由國外、網路或其他通路商購買該產品使用，以保障消費者之健康與權益。<p>◎為強化化粧品管理及取締不法，衛生署歡迎全國民眾共同協同監督不法情事，並設置為民服務電子信箱：<a href="http://faq.fda.gov.tw/Message/Default.aspx" title="http://faq.fda.gov.tw/Message/Default.aspx">http://faq.fda.gov.tw/Message/Default.aspx</a>及消保服務專線02-2787-8200，以供民眾檢舉及諮詢。民眾如因購用之化粧品發現有不良品或不良反應發生時，可通報衛生署所建置「全國化粧品不良品通報系統」，網址：<a href="http://cosmetic-recall.doh.gov.tw" title="http://cosmetic-recall.doh.gov.tw">http://cosmetic-recall.doh.gov.tw</a>，通報專線：02-2358-7343。</p>	為維護消費者健康與權益，衛生署呼籲消費者，勿自行由國外、網路或其他通路商購買該產品使用。		2010-01-18	
綠燈	有關日本(PMDA)發布訊息，株式会社Ｈａｍｓａ之化粧品「Lumiereクリーム」，因產品成分標示不全，故進行回收。	<p class="MsoNormal" style="layout-grid-mode: char; text-align: justify; margin: 0cm 0cm 0pt 16.7pt; text-justify: inter-ideograph; text-indent: -16.7pt; mso-char-indent-count: -1.39; mso-layout-grid-align: none;"><span lang="EN-US" style="font-family: 標楷體; color: black; mso-fareast-language: ja; mso-font-kerning: 0pt;">◎</span><span lang="JA" style="font-family: 標楷體; color: black; mso-bidi-font-family: 新細明體; mso-fareast-language: ja; mso-ascii-font-family: &quot;times new roman&quot;; mso-hansi-font-family: 新細明體; mso-font-kerning: 0pt;">日本（</span><span lang="EN-US" style="font-family: times new roman; color: black; mso-fareast-font-family: 標楷體; mso-bidi-font-family: 新細明體; mso-fareast-language: ja; mso-hansi-font-family: 新細明體; mso-font-kerning: 0pt;">PMDA</span><span lang="JA" style="font-family: 標楷體; color: black; mso-bidi-font-family: 新細明體; mso-fareast-language: ja; mso-ascii-font-family: &quot;times new roman&quot;; mso-hansi-font-family: 新細明體; mso-font-kerning: 0pt;">）發布消費警訊</span><span lang="JA" style="font-family: 標楷體; color: black; mso-fareast-language: ja; mso-ascii-font-family: &quot;times new roman&quot;; mso-font-kerning: 0pt;">，株式会社</span><span lang="JA" style="font-family: 標楷體; color: black; mso-fareast-language: ja; mso-ascii-font-family: &quot;times new roman&quot;; mso-hansi-font-family: &quot;times new roman&quot;; mso-font-kerning: 0pt;">Ｈａｍｓａ</span><span lang="JA" style="font-family: 標楷體; color: #000000; mso-fareast-language: ja; mso-ascii-font-family: &quot;times new roman&quot;; mso-font-kerning: 0pt;">之化粧品「</span><span lang="EN-US" style="font-family: times new roman; background: white; color: black; mso-fareast-font-family: 標楷體; mso-fareast-language: ja;">Lumiere</span><span lang="JA" style="font-family: 標楷體; background: white; color: black; mso-fareast-language: ja; mso-ascii-font-family: &quot;times new roman&quot;; mso-hansi-font-family: &quot;times new roman&quot;;">クリーム</span><span lang="EN-US" style="font-family: times new roman; color: black; mso-fareast-font-family: 標楷體; mso-fareast-language: ja; mso-hansi-font-family: 標楷體; mso-font-kerning: 0pt;">(</span><span lang="JA" style="font-family: 標楷體; color: black; mso-fareast-language: ja; mso-ascii-font-family: &quot;times new roman&quot;; mso-font-kerning: 0pt;">批號：</span><span lang="EN-US" style="font-family: times new roman; background: white; color: black; mso-fareast-font-family: 標楷體; mso-fareast-language: ja;">L012</span><span lang="JA" style="font-family: 標楷體; background: white; color: black; mso-fareast-language: ja; mso-ascii-font-family: &quot;times new roman&quot;; mso-hansi-font-family: &quot;times new roman&quot;;">～</span><span style="font-family: times new roman;"><span lang="EN-US" style="background: white; color: black; mso-fareast-font-family: 標楷體; mso-fareast-language: ja;">L018</span><span lang="EN-US" style="color: black; mso-fareast-font-family: 標楷體; mso-fareast-language: ja; mso-hansi-font-family: 標楷體; mso-font-kerning: 0pt;">)</span></span><span lang="JA" style="font-family: 標楷體; mso-fareast-language: ja; mso-ascii-font-family: &quot;times new roman&quot;; mso-font-kerning: 0pt;"><span style="color: #000000;">」，因產品</span><span style="color: black;">成分使用防腐劑</span></span><span lang="EN-US" style="font-family: times new roman; color: black; mso-fareast-font-family: 標楷體; mso-fareast-language: ja; mso-font-kerning: 0pt;">(</span><span lang="JA" style="font-family: 標楷體; color: black; mso-fareast-language: ja; mso-ascii-font-family: &quot;times new roman&quot;; mso-font-kerning: 0pt;">對羥基苯甲酸甲酯</span><span lang="EN-US" style="font-family: times new roman; color: black; mso-fareast-font-family: 標楷體; mso-fareast-language: ja; mso-font-kerning: 0pt;">)</span><span lang="JA" style="font-family: 標楷體; color: black; mso-fareast-language: ja; mso-ascii-font-family: &quot;times new roman&quot;; mso-font-kerning: 0pt;">，而未標示</span><span lang="JA" style="font-family: 標楷體; color: #000000; mso-fareast-language: ja; mso-ascii-font-family: &quot;times new roman&quot;; mso-font-kerning: 0pt;">，故進行回收。</span></p><p class="MsoNormal" style="text-align: justify; margin: 0cm 0cm 0pt 18pt; text-justify: inter-ideograph; text-indent: -18pt; mso-char-indent-count: -1.5; mso-pagination: widow-orphan;"><span lang="EN-US" style="font-family: 標楷體; color: black; mso-font-kerning: 0pt;">◎</span><span style="font-family: 標楷體; color: black; mso-ascii-font-family: &quot;times new roman&quot;; mso-hansi-font-family: &quot;times new roman&quot;; mso-font-kerning: 0pt; mso-bidi-font-weight: bold;">化粧品衛生管理條例規定化粧品須標示全成分，標示不實者，可處新台幣十萬元以下罰鍰，妨礙衛生之物品沒入銷毀之。</span></p><span lang="EN-US" style="font-size: 12pt; font-family: 標楷體; color: black; mso-bidi-font-family: &quot;times new roman&quot;; mso-ansi-language: en-us; mso-fareast-language: zh-tw; mso-bidi-language: ar-sa; mso-font-kerning: 1.0pt;">◎</span><span style="font-size: 12pt; font-family: 標楷體; color: #000000; mso-bidi-font-family: 新細明體; mso-ansi-language: en-us; mso-fareast-language: zh-tw; mso-bidi-language: ar-sa; mso-ascii-font-family: &quot;times new roman&quot;; mso-hansi-font-family: &quot;times new roman&quot;;">為強化化粧品管理及取締不法，衛生福利部歡迎全國民眾共同協同監督不法情事，並設置為民服務電子信箱：</span><strong><span lang="EN-US" style="font-size: 12pt; text-decoration: underline; font-weight: normal; color: #0070c0; mso-fareast-font-family: 標楷體; mso-ansi-language: en-us; mso-fareast-language: zh-tw; mso-bidi-language: ar-sa; mso-font-kerning: 1.0pt; mso-bidi-font-weight: bold;"><a href="http://faq.fda.gov.tw/Message/Default.aspx" title="http://faq.fda.gov.tw/Message/Default.aspx"><span style="font-family: times new roman; color: #0070c0;">http://faq.fda.gov.tw/Message/Default.aspx</span></a></span></strong><span style="color: #000000;"><span style="font-size: 12pt; font-family: 標楷體; mso-bidi-font-family: 新細明體; mso-ansi-language: en-us; mso-fareast-language: zh-tw; mso-bidi-language: ar-sa; mso-ascii-font-family: &quot;times new roman&quot;; mso-hansi-font-family: &quot;times new roman&quot;;">及消保服務專線</span><span lang="EN-US" style="font-size: 12pt; font-family: &quot;times new roman&quot;,&quot;serif&quot;; mso-fareast-font-family: 標楷體; mso-bidi-font-family: 新細明體; mso-ansi-language: en-us; mso-fareast-language: zh-tw; mso-bidi-language: ar-sa;">02-2787-8080</span><span style="font-size: 12pt; font-family: 標楷體; mso-bidi-font-family: 新細明體; mso-ansi-language: en-us; mso-fareast-language: zh-tw; mso-bidi-language: ar-sa; mso-ascii-font-family: &quot;times new roman&quot;; mso-hansi-font-family: &quot;times new roman&quot;;">，以供民眾檢舉及諮詢。民眾如因購用之化粧品發現有不良品或不良反應發生時，可通報衛生福利部所建置「全國化粧品不良事件通報系統」，網址：</span></span><span lang="EN-US" style="font-size: 12pt; text-decoration: underline; font-family: &quot;times new roman&quot;,&quot;serif&quot;; color: #0070c0; mso-fareast-font-family: 新細明體; mso-ansi-language: en-us; mso-fareast-language: zh-tw; mso-bidi-language: ar-sa; mso-font-kerning: 1.0pt;"><a href="https://qms.fda.gov.tw/tcbw/" title=" https://qms.fda.gov.tw/tcbw/"><span style="color: #0070c0;">https://qms.fda.gov.tw/tcbw/</span></a></span><span style="color: #000000;"><span style="font-size: 12pt; font-family: 標楷體; mso-bidi-font-family: 新細明體; mso-ansi-language: en-us; mso-fareast-language: zh-tw; mso-bidi-language: ar-sa; mso-ascii-font-family: &quot;times new roman&quot;; mso-hansi-font-family: &quot;times new roman&quot;;">，通報專線：</span><span lang="EN-US" style="font-size: 12pt; font-family: &quot;times new roman&quot;,&quot;serif&quot;; mso-fareast-font-family: 標楷體; mso-bidi-font-family: 新細明體; mso-ansi-language: en-us; mso-fareast-language: zh-tw; mso-bidi-language: ar-sa;">02-66251166</span><span style="font-size: 12pt; font-family: 標楷體; mso-bidi-font-family: 新細明體; mso-ansi-language: en-us; mso-fareast-language: zh-tw; mso-bidi-language: ar-sa; mso-ascii-font-family: &quot;times new roman&quot;; mso-hansi-font-family: &quot;times new roman&quot;;">轉</span><span lang="EN-US" style="font-size: 12pt; font-family: &quot;times new roman&quot;,&quot;serif&quot;; mso-fareast-font-family: 標楷體; mso-bidi-font-family: 新細明體; mso-ansi-language: en-us; mso-fareast-language: zh-tw; mso-bidi-language: ar-sa;">6401</span><span style="font-size: 12pt; font-family: 標楷體; mso-bidi-font-family: 新細明體; mso-ansi-language: en-us; mso-fareast-language: zh-tw; mso-bidi-language: ar-sa; mso-ascii-font-family: &quot;times new roman&quot;; mso-hansi-font-family: &quot;times new roman&quot;;">。</span></span>	<span style="font-size: 12pt; font-family: 標楷體; color: #000000; mso-bidi-font-family: &quot;times new roman&quot;; mso-ansi-language: en-us; mso-fareast-language: zh-tw; mso-bidi-language: ar-sa; mso-ascii-font-family: &quot;times new roman&quot;; mso-font-kerning: 1.0pt;">本案經初步評估，判定列屬綠燈，消費者勿需恐慌。</span>		2015-10-01	
綠燈	有關日本(PMDA)發布訊息，株式会社Ｈａｍｓａ之化粧品「Merciクリーム」，因產品成分標示不全，故進行回收。	<p class="MsoNormal" style="layout-grid-mode: char; text-align: justify; margin: 0cm 0cm 0pt 16.7pt; text-justify: inter-ideograph; text-indent: -16.7pt; mso-char-indent-count: -1.39; mso-layout-grid-align: none;"><span lang="EN-US" style="font-family: 標楷體; color: black; mso-fareast-language: ja; mso-font-kerning: 0pt;">◎</span><span lang="JA" style="font-family: 標楷體; color: black; mso-bidi-font-family: 新細明體; mso-fareast-language: ja; mso-ascii-font-family: &quot;times new roman&quot;; mso-hansi-font-family: 新細明體; mso-font-kerning: 0pt;">日本（</span><span lang="EN-US" style="font-family: times new roman; color: black; mso-fareast-font-family: 標楷體; mso-bidi-font-family: 新細明體; mso-fareast-language: ja; mso-hansi-font-family: 新細明體; mso-font-kerning: 0pt;">PMDA</span><span lang="JA" style="font-family: 標楷體; color: black; mso-bidi-font-family: 新細明體; mso-fareast-language: ja; mso-ascii-font-family: &quot;times new roman&quot;; mso-hansi-font-family: 新細明體; mso-font-kerning: 0pt;">）發布消費警訊</span><span lang="JA" style="font-family: 標楷體; color: black; mso-fareast-language: ja; mso-ascii-font-family: &quot;times new roman&quot;; mso-font-kerning: 0pt;">，株式会社</span><span lang="JA" style="font-family: 標楷體; color: black; mso-fareast-language: ja; mso-ascii-font-family: &quot;times new roman&quot;; mso-hansi-font-family: &quot;times new roman&quot;; mso-font-kerning: 0pt;">Ｈａｍｓａ</span><span lang="JA" style="font-family: 標楷體; color: #000000; mso-fareast-language: ja; mso-ascii-font-family: &quot;times new roman&quot;; mso-font-kerning: 0pt;">之化粧品「</span><span lang="EN-US" style="font-family: times new roman; color: black; mso-fareast-font-family: 標楷體; mso-fareast-language: ja; mso-font-kerning: 0pt;">Merci</span><span lang="JA" style="font-family: 標楷體; color: black; mso-fareast-language: ja; mso-ascii-font-family: &quot;times new roman&quot;; mso-font-kerning: 0pt;">クリーム</span><span lang="EN-US" style="font-family: times new roman; color: black; mso-fareast-font-family: 標楷體; mso-fareast-language: ja; mso-hansi-font-family: 標楷體; mso-font-kerning: 0pt;">(</span><span lang="JA" style="font-family: 標楷體; color: black; mso-fareast-language: ja; mso-ascii-font-family: &quot;times new roman&quot;; mso-font-kerning: 0pt;">批號：</span><span lang="EN-US" style="font-family: times new roman; background: white; color: black; mso-fareast-font-family: 標楷體; mso-fareast-language: ja;">M016</span><span lang="JA" style="font-family: 標楷體; background: white; color: black; mso-fareast-language: ja; mso-ascii-font-family: &quot;times new roman&quot;; mso-hansi-font-family: &quot;times new roman&quot;;">～</span><span style="font-family: times new roman;"><span lang="EN-US" style="background: white; color: black; mso-fareast-font-family: 標楷體; mso-fareast-language: ja;">M025</span><span lang="EN-US" style="color: black; mso-fareast-font-family: 標楷體; mso-fareast-language: ja; mso-hansi-font-family: 標楷體; mso-font-kerning: 0pt;">)</span></span><span lang="JA" style="font-family: 標楷體; mso-fareast-language: ja; mso-ascii-font-family: &quot;times new roman&quot;; mso-font-kerning: 0pt;"><span style="color: #000000;">」，因產品</span><span style="color: black;">成分使用防腐劑</span></span><span lang="EN-US" style="font-family: times new roman; color: black; mso-fareast-font-family: 標楷體; mso-fareast-language: ja; mso-font-kerning: 0pt;">(</span><span lang="JA" style="font-family: 標楷體; color: black; mso-fareast-language: ja; mso-ascii-font-family: &quot;times new roman&quot;; mso-font-kerning: 0pt;">對羥基苯甲酸甲酯</span><span lang="EN-US" style="font-family: times new roman; color: black; mso-fareast-font-family: 標楷體; mso-fareast-language: ja; mso-font-kerning: 0pt;">)</span><span lang="JA" style="font-family: 標楷體; color: black; mso-fareast-language: ja; mso-ascii-font-family: &quot;times new roman&quot;; mso-font-kerning: 0pt;">，而未標示</span><span style="color: #000000;"><span lang="JA" style="font-family: 標楷體; mso-fareast-language: ja; mso-ascii-font-family: &quot;times new roman&quot;; mso-font-kerning: 0pt;">，故進行回收</span><span style="font-family: 標楷體; mso-ascii-font-family: &quot;times new roman&quot;; mso-font-kerning: 0pt;">。</span></span></p><p class="MsoNormal" style="text-align: justify; margin: 0cm 0cm 0pt 18pt; text-justify: inter-ideograph; text-indent: -18pt; mso-char-indent-count: -1.5; mso-pagination: widow-orphan;"><span lang="EN-US" style="font-family: 標楷體; color: black; mso-font-kerning: 0pt;">◎</span><span style="font-family: 標楷體; color: black; mso-ascii-font-family: &quot;times new roman&quot;; mso-hansi-font-family: &quot;times new roman&quot;; mso-font-kerning: 0pt; mso-bidi-font-weight: bold;">化粧品衛生管理條例規定化粧品須標示全成分，標示不實者，可處新台幣十萬元以下罰鍰，妨礙衛生之物品沒入銷毀之。</span></p><span lang="EN-US" style="font-size: 12pt; font-family: 標楷體; color: black; mso-bidi-font-family: &quot;times new roman&quot;; mso-ansi-language: en-us; mso-fareast-language: zh-tw; mso-bidi-language: ar-sa; mso-font-kerning: 1.0pt;">◎</span><span style="font-size: 12pt; font-family: 標楷體; color: #000000; mso-bidi-font-family: 新細明體; mso-ansi-language: en-us; mso-fareast-language: zh-tw; mso-bidi-language: ar-sa; mso-ascii-font-family: &quot;times new roman&quot;; mso-hansi-font-family: &quot;times new roman&quot;;">為強化化粧品管理及取締不法，衛生福利部歡迎全國民眾共同協同監督不法情事，並設置為民服務電子信箱：</span><strong><span lang="EN-US" style="font-size: 12pt; text-decoration: underline; font-weight: normal; color: #0070c0; mso-fareast-font-family: 標楷體; mso-ansi-language: en-us; mso-fareast-language: zh-tw; mso-bidi-language: ar-sa; mso-font-kerning: 1.0pt; mso-bidi-font-weight: bold;"><a href="http://faq.fda.gov.tw/Message/Default.aspx" title="http://faq.fda.gov.tw/Message/Default.aspx"><span style="font-family: times new roman; color: #0070c0;">http://faq.fda.gov.tw/Message/Default.aspx</span></a></span></strong><span style="color: #000000;"><span style="font-size: 12pt; font-family: 標楷體; mso-bidi-font-family: 新細明體; mso-ansi-language: en-us; mso-fareast-language: zh-tw; mso-bidi-language: ar-sa; mso-ascii-font-family: &quot;times new roman&quot;; mso-hansi-font-family: &quot;times new roman&quot;;">及消保服務專線</span><span lang="EN-US" style="font-size: 12pt; font-family: &quot;times new roman&quot;,&quot;serif&quot;; mso-fareast-font-family: 標楷體; mso-bidi-font-family: 新細明體; mso-ansi-language: en-us; mso-fareast-language: zh-tw; mso-bidi-language: ar-sa;">02-2787-8080</span><span style="font-size: 12pt; font-family: 標楷體; mso-bidi-font-family: 新細明體; mso-ansi-language: en-us; mso-fareast-language: zh-tw; mso-bidi-language: ar-sa; mso-ascii-font-family: &quot;times new roman&quot;; mso-hansi-font-family: &quot;times new roman&quot;;">，以供民眾檢舉及諮詢。民眾如因購用之化粧品發現有不良品或不良反應發生時，可通報衛生福利部所建置「全國化粧品不良事件通報系統」，網址：</span></span><span lang="EN-US" style="font-size: 12pt; text-decoration: underline; font-family: &quot;times new roman&quot;,&quot;serif&quot;; color: #0070c0; mso-fareast-font-family: 新細明體; mso-ansi-language: en-us; mso-fareast-language: zh-tw; mso-bidi-language: ar-sa; mso-font-kerning: 1.0pt;"><a href="https://qms.fda.gov.tw/tcbw/" title=" https://qms.fda.gov.tw/tcbw/"><span style="color: #0070c0;">https://qms.fda.gov.tw/tcbw/</span></a></span><span style="color: #000000;"><span style="font-size: 12pt; font-family: 標楷體; mso-bidi-font-family: 新細明體; mso-ansi-language: en-us; mso-fareast-language: zh-tw; mso-bidi-language: ar-sa; mso-ascii-font-family: &quot;times new roman&quot;; mso-hansi-font-family: &quot;times new roman&quot;;">，通報專線：</span><span lang="EN-US" style="font-size: 12pt; font-family: &quot;times new roman&quot;,&quot;serif&quot;; mso-fareast-font-family: 標楷體; mso-bidi-font-family: 新細明體; mso-ansi-language: en-us; mso-fareast-language: zh-tw; mso-bidi-language: ar-sa;">02-66251166</span><span style="font-size: 12pt; font-family: 標楷體; mso-bidi-font-family: 新細明體; mso-ansi-language: en-us; mso-fareast-language: zh-tw; mso-bidi-language: ar-sa; mso-ascii-font-family: &quot;times new roman&quot;; mso-hansi-font-family: &quot;times new roman&quot;;">轉</span><span lang="EN-US" style="font-size: 12pt; font-family: &quot;times new roman&quot;,&quot;serif&quot;; mso-fareast-font-family: 標楷體; mso-bidi-font-family: 新細明體; mso-ansi-language: en-us; mso-fareast-language: zh-tw; mso-bidi-language: ar-sa;">6401</span><span style="font-size: 12pt; font-family: 標楷體; mso-bidi-font-family: 新細明體; mso-ansi-language: en-us; mso-fareast-language: zh-tw; mso-bidi-language: ar-sa; mso-ascii-font-family: &quot;times new roman&quot;; mso-hansi-font-family: &quot;times new roman&quot;;">。</span></span>	<span style="font-size: 12pt; font-family: 標楷體; color: #000000; mso-bidi-font-family: &quot;times new roman&quot;; mso-ansi-language: en-us; mso-fareast-language: zh-tw; mso-bidi-language: ar-sa; mso-ascii-font-family: &quot;times new roman&quot;; mso-font-kerning: 1.0pt;">本案經初步評估，判定列屬綠燈，消費者勿需恐慌。</span>		2015-10-01	
