紅燈	有關歐盟發布訊息，德國Orion廠製造之Crème - Penis XXL Creme化粧品遭微生物污染而回收乙事：	◎德國Orion廠製造之Cr&egrave;me - Penis XXL Creme化粧品，批號：Manufacturing code: 33 06.2012，EAN code: 4 024 144 610334，因生菌數過量，且檢出含有Enterobacter gergoviae 1.6 x 104 CFU/g，可能影響人體健康，故回收此產品。 ◎為確保化粧品之品質及消費者之使用安全，衛生署已於94年9月間公告訂定「化粧品中微生物容許量基準」，規範生菌數容許量如下：（1）嬰兒用、眼部周圍用及使用於接觸黏膜部位之化粧品必須在100 CFU/g或mL以下。（2）其他類化粧品必須在1000 CFU/g或mL以下。且不得檢出大腸桿菌（Escherichia coli）、綠膿桿菌（Pseudomonas aeruginosa）或金黃色葡萄球菌（Staphylococcus aureus）等，違反者，可處新臺幣10萬元以下罰鍰，其妨害衛生之物品沒入銷燬之。 ◎衛生署呼籲消費者勿自行由國外、網路或其他通路商購買該產品使用，以保障消費者之健康與權益。為強化化粧品管理及取締不法，本署歡迎全國民眾共同監督不法情事，並設置為民服務電子信箱：http://www.fda.gov.tw/people_mail.aspx，檢舉傳真：02-2523-0155。	為維護消費者健康與權益，衛生署呼籲消費者，勿自行由國外、網路或其他通路商購買該產品使用。		2010-02-01	
黃燈	日本發布消費警訊，株式会社アインズラボ製造「インディジェナスソープ　アイナ」之化粧品，顧客使用產品時發現異物，因此業者主動回收乙事。	<pre style="background: white;"><span lang="EN-US" style="font-family: 標楷體; color: #000000; mso-fareast-language: ja;">◎</span><span lang="JA" style="font-family: 標楷體; background: white; color: #333333; mso-font-kerning: 1.0pt; mso-bidi-font-family: &quot;times new roman&quot;; mso-ascii-font-family: &quot;times new roman&quot;; mso-fareast-language: ja;">日本發布消費警訊，株式会社アインズラボ製造「インディジェナスソープ　アイナ化粧品</span><span lang="EN-US" style="font-family: &quot;times new roman&quot;,&quot;serif&quot;; background: white; color: #333333; mso-fareast-font-family: 標楷體; mso-font-kerning: 1.0pt; mso-fareast-language: ja;">(</span><span lang="JA" style="font-family: 標楷體; background: white; color: #333333; mso-font-kerning: 1.0pt; mso-bidi-font-family: &quot;times new roman&quot;; mso-ascii-font-family: &quot;times new roman&quot;; mso-fareast-language: ja;">批號：</span><span lang="EN-US" style="font-family: &quot;times new roman&quot;,&quot;serif&quot;; background: white; color: #333333; mso-fareast-font-family: 標楷體; mso-font-kerning: 1.0pt; mso-fareast-language: ja;">D003,D080,D119,D145,D161,D224,E033)</span><span lang="JA" style="font-family: 標楷體; background: white; color: #333333; mso-font-kerning: 1.0pt; mso-bidi-font-family: &quot;times new roman&quot;; mso-ascii-font-family: &quot;times new roman&quot;; mso-fareast-language: ja;">，因顧客使用產品時發現異物，分析調查後為製造程序時塑料片</span><span lang="EN-US" style="font-family: &quot;times new roman&quot;,&quot;serif&quot;; background: white; color: #333333; mso-fareast-font-family: 標楷體; mso-font-kerning: 1.0pt; mso-fareast-language: ja;">(</span><span lang="JA" style="font-family: 標楷體; background: white; color: #333333; mso-font-kerning: 1.0pt; mso-bidi-font-family: &quot;times new roman&quot;; mso-ascii-font-family: &quot;times new roman&quot;; mso-fareast-language: ja;">聚乙烯</span><span lang="EN-US" style="font-family: &quot;times new roman&quot;,&quot;serif&quot;; background: white; color: #333333; mso-fareast-font-family: 標楷體; mso-font-kerning: 1.0pt; mso-fareast-language: ja;">)</span><span lang="JA" style="font-family: 標楷體; background: white; color: #333333; mso-font-kerning: 1.0pt; mso-bidi-font-family: &quot;times new roman&quot;; mso-ascii-font-family: &quot;times new roman&quot;; mso-fareast-language: ja;">混入，因此業者主動進行回收。</span></pre><p class="MsoNormal" style="text-align: justify; margin: 0cm 0cm 0pt 18pt; text-justify: inter-ideograph; text-indent: -18pt; mso-pagination: widow-orphan; mso-char-indent-count: -1.5; punctuation-wrap: simple; mso-line-break-override: restrictions;"><span lang="EN-US" style="font-family: 標楷體; color: #000000; mso-font-kerning: 0pt;">◎</span><span style="font-family: 標楷體; background: white; color: #333333;">為確保化粧品之品質及消費者之使用安全，產品倘有損害消費者健康之虞，依據消費者保護法廠商應將此商品回收，銷毀。並停止輸入，販售。</span><span class="apple-converted-space" lang="EN-US" style="font-family: &quot;arial&quot;,&quot;sans-serif&quot;; background: white; color: #333333;">&nbsp;</span></p><p class="MsoNormal" style="text-align: justify; margin: 0cm 0cm 0pt 18pt; text-justify: inter-ideograph; text-indent: -18pt; mso-pagination: widow-orphan; mso-char-indent-count: -1.5;"><span lang="EN-US" style="font-family: 標楷體; color: #000000; mso-font-kerning: 0pt;">◎</span><span style="font-family: 標楷體; color: #000000; mso-bidi-font-family: arial;">衛生福利部</span><span style="font-family: 標楷體; color: #000000; mso-font-kerning: 0pt; mso-ascii-font-family: &quot;times new roman&quot;; mso-hansi-font-family: &quot;times new roman&quot;;">並未核准該產品進口販售，呼籲消費者不要</span><span style="font-family: 標楷體; color: #000000; mso-ascii-font-family: &quot;times new roman&quot;; mso-hansi-font-family: &quot;times new roman&quot;;">自網路或其他通路商購買該產品使用</span><span style="font-family: 標楷體; color: #000000; mso-font-kerning: 0pt; mso-ascii-font-family: &quot;times new roman&quot;; mso-hansi-font-family: &quot;times new roman&quot;;">。</span></p><span lang="EN-US" style="font-size: 12pt; font-family: 標楷體; color: #000000; mso-font-kerning: 1.0pt; mso-bidi-font-family: &quot;times new roman&quot;; mso-fareast-language: zh-tw; mso-ansi-language: en-us; mso-bidi-language: ar-sa;">◎ </span><span style="font-size: 12pt; font-family: 標楷體; color: #000000; mso-font-kerning: 1.0pt; mso-bidi-font-family: &quot;times new roman&quot;; mso-ascii-font-family: &quot;times new roman&quot;; mso-fareast-language: zh-tw; mso-ansi-language: en-us; mso-bidi-language: ar-sa;">為強化化粧品管理及取締不法，</span><span style="font-size: 12pt; font-family: 標楷體; color: #000000; mso-font-kerning: 1.0pt; mso-bidi-font-family: arial; mso-fareast-language: zh-tw; mso-ansi-language: en-us; mso-bidi-language: ar-sa;">衛生福利部</span><span style="font-size: 12pt; font-family: 標楷體; color: #000000; mso-font-kerning: 1.0pt; mso-bidi-font-family: &quot;times new roman&quot;; mso-ascii-font-family: &quot;times new roman&quot;; mso-fareast-language: zh-tw; mso-ansi-language: en-us; mso-bidi-language: ar-sa;">歡迎全國民眾共同協同監督不法情事，並設置為民服務電子信箱：</span><span lang="EN-US" style="font-size: 12pt; font-family: &quot;times new roman&quot;,&quot;serif&quot;; mso-fareast-font-family: 新細明體; mso-font-kerning: 1.0pt; mso-fareast-language: zh-tw; mso-ansi-language: en-us; mso-bidi-language: ar-sa;"><a href="http://faq.fda.gov.tw/Message/Default.aspx" title="http://faq.fda.gov.tw/Message/Default.aspx"><span style="color: #0000ff; mso-bidi-font-family: arial;">http://faq.fda.gov.tw/Message/Default.aspx</span></a></span><span style="font-size: 12pt; font-family: 標楷體; color: #000000; mso-font-kerning: 1.0pt; mso-bidi-font-family: &quot;times new roman&quot;; mso-fareast-language: zh-tw; mso-ansi-language: en-us; mso-bidi-language: ar-sa;">及</span><span style="font-size: 12pt; font-family: 標楷體; color: #000000; mso-font-kerning: 1.0pt; mso-bidi-font-family: &quot;times new roman&quot;; mso-ascii-font-family: &quot;times new roman&quot;; mso-fareast-language: zh-tw; mso-ansi-language: en-us; mso-bidi-language: ar-sa;">消保服務專線</span><span lang="EN-US" style="font-size: 12pt; font-family: &quot;times new roman&quot;,&quot;serif&quot;; color: #000000; mso-fareast-font-family: 標楷體; mso-font-kerning: 1.0pt; mso-fareast-language: zh-tw; mso-ansi-language: en-us; mso-bidi-language: ar-sa;">02-2787-8200</span><span style="font-size: 12pt; font-family: 標楷體; color: #000000; mso-font-kerning: 1.0pt; mso-bidi-font-family: &quot;times new roman&quot;; mso-ascii-font-family: &quot;times new roman&quot;; mso-fareast-language: zh-tw; mso-ansi-language: en-us; mso-bidi-language: ar-sa;">，以供民眾檢舉及諮詢。民眾如因購用之化粧品發現有不良品或不良反應發生時，可通報</span><span style="font-size: 12pt; font-family: 標楷體; color: #000000; mso-font-kerning: 1.0pt; mso-bidi-font-family: arial; mso-fareast-language: zh-tw; mso-ansi-language: en-us; mso-bidi-language: ar-sa;">衛生福利部</span><span style="font-size: 12pt; font-family: 標楷體; color: #000000; mso-font-kerning: 1.0pt; mso-bidi-font-family: &quot;times new roman&quot;; mso-ascii-font-family: &quot;times new roman&quot;; mso-fareast-language: zh-tw; mso-ansi-language: en-us; mso-bidi-language: ar-sa;">所建置</span><strong><span style="font-size: 12pt; font-family: 標楷體; font-weight: normal; color: #000000; mso-font-kerning: 1.0pt; mso-ascii-font-family: &quot;times new roman&quot;; mso-hansi-font-family: &quot;times new roman&quot;; mso-fareast-language: zh-tw; mso-bidi-font-weight: bold; mso-ansi-language: en-us; mso-bidi-language: ar-sa;">「全國化粧品不良事件通報系統」，網址：</span></strong><span lang="EN-US" style="font-size: 12pt; font-family: &quot;times new roman&quot;,&quot;serif&quot;; color: #0000ff; mso-fareast-font-family: 新細明體; mso-font-kerning: 1.0pt; mso-fareast-language: zh-tw; mso-ansi-language: en-us; mso-bidi-language: ar-sa;"><a href="https://qms.fda.gov.tw/tcbw/" title=" https://qms.fda.gov.tw/tcbw/">https://qms.fda.gov.tw/tcbw/</a></span><span style="font-size: 12pt; font-family: 標楷體; color: #000000; mso-font-kerning: 1.0pt; mso-bidi-font-family: &quot;times new roman&quot;; mso-ascii-font-family: &quot;times new roman&quot;; mso-fareast-language: zh-tw; mso-ansi-language: en-us; mso-bidi-language: ar-sa;">，通報專線：</span><span lang="EN-US" style="font-size: 12pt; font-family: &quot;times new roman&quot;,&quot;serif&quot;; color: #000000; mso-fareast-font-family: 標楷體; mso-font-kerning: 1.0pt; mso-hansi-font-family: 標楷體; mso-fareast-language: zh-tw; mso-ansi-language: en-us; mso-bidi-language: ar-sa;">02-66251166</span><span style="font-size: 12pt; font-family: 標楷體; color: #000000; mso-font-kerning: 1.0pt; mso-bidi-font-family: &quot;times new roman&quot;; mso-ascii-font-family: &quot;times new roman&quot;; mso-fareast-language: zh-tw; mso-ansi-language: en-us; mso-bidi-language: ar-sa;">轉</span><span lang="EN-US" style="font-size: 12pt; font-family: &quot;times new roman&quot;,&quot;serif&quot;; color: #000000; mso-fareast-font-family: 標楷體; mso-font-kerning: 1.0pt; mso-hansi-font-family: 標楷體; mso-fareast-language: zh-tw; mso-ansi-language: en-us; mso-bidi-language: ar-sa;">6401</span><span style="font-size: 12pt; font-family: 標楷體; color: #000000; mso-font-kerning: 1.0pt; mso-bidi-font-family: &quot;times new roman&quot;; mso-ascii-font-family: &quot;times new roman&quot;; mso-fareast-language: zh-tw; mso-ansi-language: en-us; mso-bidi-language: ar-sa;">。</span>	<span style="font-size: 12pt; font-family: 標楷體; color: #000000; mso-font-kerning: 1.0pt; mso-bidi-font-family: &quot;times new roman&quot;; mso-ascii-font-family: &quot;times new roman&quot;; mso-fareast-language: zh-tw; mso-ansi-language: en-us; mso-bidi-language: ar-sa;">為維護消費者健康與權益，衛生福利部呼籲消費者，勿自行由國外、網路或其他通路商購買該產品使用。</span>		2015-07-01	
黃燈	日本發布消費警訊，株式会社アインズラボ「インディジェナスソープ　ティーツリーパチョリ　Ｂ」之化粧品，顧客使用產品時發現異物，因此業者主動回收乙事。	<pre style="background: white;"><span lang="EN-US" style="font-family: 標楷體; background: white; color: #333333; mso-font-kerning: 1.0pt; mso-bidi-font-family: &quot;times new roman&quot;; mso-ascii-font-family: &quot;times new roman&quot;; mso-fareast-language: ja;">◎</span><span lang="JA" style="font-family: 標楷體; background: white; color: #333333; mso-font-kerning: 1.0pt; mso-bidi-font-family: &quot;times new roman&quot;; mso-ascii-font-family: &quot;times new roman&quot;; mso-fareast-language: ja;">日本發布消費警訊，株式会社アインズラボ製造「インディジェナスソープ　ティーツリーパチョリＢ」化粧品</span><span lang="EN-US" style="font-family: &quot;times new roman&quot;,&quot;serif&quot;; background: white; color: #333333; mso-fareast-font-family: 標楷體; mso-font-kerning: 1.0pt; mso-hansi-font-family: 標楷體; mso-fareast-language: ja;">(</span><span lang="JA" style="font-family: 標楷體; background: white; color: #333333; mso-font-kerning: 1.0pt; mso-bidi-font-family: &quot;times new roman&quot;; mso-ascii-font-family: &quot;times new roman&quot;; mso-fareast-language: ja;">批號：</span><span lang="EN-US" style="font-family: &quot;times new roman&quot;,&quot;serif&quot;; background: white; color: #333333; mso-fareast-font-family: 標楷體; mso-font-kerning: 1.0pt; mso-hansi-font-family: 標楷體; mso-fareast-language: ja;">D119,D145,D161,D224,E033)</span><span lang="JA" style="font-family: 標楷體; background: white; color: #333333; mso-font-kerning: 1.0pt; mso-bidi-font-family: &quot;times new roman&quot;; mso-ascii-font-family: &quot;times new roman&quot;; mso-fareast-language: ja;">，因顧客使用產品時發現異物，分析調查後為製造程序時塑料片</span><span lang="EN-US" style="font-family: &quot;times new roman&quot;,&quot;serif&quot;; background: white; color: #333333; mso-fareast-font-family: 標楷體; mso-font-kerning: 1.0pt; mso-hansi-font-family: 標楷體; mso-fareast-language: ja;">(</span><span lang="JA" style="font-family: 標楷體; background: white; color: #333333; mso-font-kerning: 1.0pt; mso-bidi-font-family: &quot;times new roman&quot;; mso-ascii-font-family: &quot;times new roman&quot;; mso-fareast-language: ja;">聚乙烯</span><span lang="EN-US" style="font-family: &quot;times new roman&quot;,&quot;serif&quot;; background: white; color: #333333; mso-fareast-font-family: 標楷體; mso-font-kerning: 1.0pt; mso-hansi-font-family: 標楷體; mso-fareast-language: ja;">)</span><span lang="JA" style="font-family: 標楷體; background: white; color: #333333; mso-font-kerning: 1.0pt; mso-bidi-font-family: &quot;times new roman&quot;; mso-ascii-font-family: &quot;times new roman&quot;; mso-fareast-language: ja;">的混入可能性高，因此業者主動進行回收。</span></pre><p class="MsoNormal" style="text-align: justify; margin: 0cm 0cm 0pt 18pt; text-justify: inter-ideograph; text-indent: -18pt; mso-pagination: widow-orphan; mso-char-indent-count: -1.5; punctuation-wrap: simple; mso-line-break-override: restrictions;"><span lang="EN-US" style="font-family: 標楷體; background: white; color: #333333; mso-ascii-font-family: &quot;times new roman&quot;; mso-fareast-language: ja;">◎</span><span lang="JA" style="font-family: 標楷體; background: white; color: #333333; mso-ascii-font-family: &quot;times new roman&quot;; mso-fareast-language: ja;">為確保化粧品之品質及消費者之使用安全，產品倘有損害消費者健康之虞，依據消費者保護法廠商應將此商品回收，銷毀。並停止輸入，販售。</span><span lang="EN-US" style="font-family: 標楷體; color: #000000; mso-ascii-font-family: &quot;times new roman&quot;; mso-fareast-language: ja;">&nbsp;</span></p><p class="MsoNormal" style="text-align: justify; margin: 0cm 0cm 0pt 18pt; text-justify: inter-ideograph; text-indent: -18pt; mso-pagination: widow-orphan; mso-char-indent-count: -1.5;"><span lang="EN-US" style="font-family: 標楷體; background: white; color: #333333; mso-ascii-font-family: &quot;times new roman&quot;; mso-fareast-language: ja;">◎</span><span lang="JA" style="font-family: 標楷體; background: white; color: #333333; mso-ascii-font-family: &quot;times new roman&quot;; mso-fareast-language: ja;">衛生福利部並未核准該產品進口販售，呼籲消費者不要自網路或其他通路商購買該產品使用。</span></p><span lang="EN-US" style="font-size: 12pt; font-family: 標楷體; background: white; color: #333333; mso-font-kerning: 1.0pt; mso-bidi-font-family: &quot;times new roman&quot;; mso-ascii-font-family: &quot;times new roman&quot;; mso-fareast-language: ja; mso-ansi-language: en-us; mso-bidi-language: ar-sa;">◎</span><span style="font-size: 12pt; font-family: 標楷體; color: #000000; mso-font-kerning: 1.0pt; mso-bidi-font-family: &quot;times new roman&quot;; mso-ascii-font-family: &quot;times new roman&quot;; mso-fareast-language: zh-tw; mso-ansi-language: en-us; mso-bidi-language: ar-sa;">為強化化粧品管理及取締不法，</span><span style="font-size: 12pt; font-family: 標楷體; color: #000000; mso-font-kerning: 1.0pt; mso-bidi-font-family: arial; mso-fareast-language: zh-tw; mso-ansi-language: en-us; mso-bidi-language: ar-sa;">衛生福利部</span><span style="font-size: 12pt; font-family: 標楷體; color: #000000; mso-font-kerning: 1.0pt; mso-bidi-font-family: &quot;times new roman&quot;; mso-ascii-font-family: &quot;times new roman&quot;; mso-fareast-language: zh-tw; mso-ansi-language: en-us; mso-bidi-language: ar-sa;">歡迎全國民眾共同協同監督不法情事，並設置為民服務電子信箱：</span><span lang="EN-US" style="font-size: 12pt; font-family: &quot;times new roman&quot;,&quot;serif&quot;; mso-fareast-font-family: 新細明體; mso-font-kerning: 1.0pt; mso-fareast-language: zh-tw; mso-ansi-language: en-us; mso-bidi-language: ar-sa;"><a href="http://faq.fda.gov.tw/Message/Default.aspx" title="http://faq.fda.gov.tw/Message/Default.aspx"><span style="color: #0000ff; mso-bidi-font-family: arial;">http://faq.fda.gov.tw/Message/Default.aspx</span></a></span><span style="font-size: 12pt; font-family: 標楷體; color: #000000; mso-font-kerning: 1.0pt; mso-bidi-font-family: &quot;times new roman&quot;; mso-fareast-language: zh-tw; mso-ansi-language: en-us; mso-bidi-language: ar-sa;">及</span><span style="font-size: 12pt; font-family: 標楷體; color: #000000; mso-font-kerning: 1.0pt; mso-bidi-font-family: &quot;times new roman&quot;; mso-ascii-font-family: &quot;times new roman&quot;; mso-fareast-language: zh-tw; mso-ansi-language: en-us; mso-bidi-language: ar-sa;">消保服務專線</span><span lang="EN-US" style="font-size: 12pt; font-family: &quot;times new roman&quot;,&quot;serif&quot;; color: #000000; mso-fareast-font-family: 標楷體; mso-font-kerning: 1.0pt; mso-fareast-language: zh-tw; mso-ansi-language: en-us; mso-bidi-language: ar-sa;">02-2787-8200</span><span style="font-size: 12pt; font-family: 標楷體; color: #000000; mso-font-kerning: 1.0pt; mso-bidi-font-family: &quot;times new roman&quot;; mso-ascii-font-family: &quot;times new roman&quot;; mso-fareast-language: zh-tw; mso-ansi-language: en-us; mso-bidi-language: ar-sa;">，以供民眾檢舉及諮詢。民眾如因購用之化粧品發現有不良品或不良反應發生時，可通報</span><span style="font-size: 12pt; font-family: 標楷體; color: #000000; mso-font-kerning: 1.0pt; mso-bidi-font-family: arial; mso-fareast-language: zh-tw; mso-ansi-language: en-us; mso-bidi-language: ar-sa;">衛生福利部</span><span style="font-size: 12pt; font-family: 標楷體; color: #000000; mso-font-kerning: 1.0pt; mso-bidi-font-family: &quot;times new roman&quot;; mso-ascii-font-family: &quot;times new roman&quot;; mso-fareast-language: zh-tw; mso-ansi-language: en-us; mso-bidi-language: ar-sa;">所建置</span><strong><span style="font-size: 12pt; font-family: 標楷體; font-weight: normal; color: #000000; mso-font-kerning: 1.0pt; mso-ascii-font-family: &quot;times new roman&quot;; mso-hansi-font-family: &quot;times new roman&quot;; mso-fareast-language: zh-tw; mso-bidi-font-weight: bold; mso-ansi-language: en-us; mso-bidi-language: ar-sa;">「全國化粧品不良事件通報系統」，網址：<span lang="EN-US" style="font-family: &quot;&quot;serif&quot;&quot;,&quot;serif&quot;; color: blue; mso-bidi-font-family: arial;"><a href="https://qms.fda.gov.tw/tcbw/" title=" https://qms.fda.gov.tw/tcbw/"><span style="font-family: calibri; color: #0000ff;">https://qms.fda.gov.tw/tcbw/</span></a></span></span></strong><span style="font-size: 12pt; font-family: 標楷體; color: #000000; mso-font-kerning: 1.0pt; mso-bidi-font-family: &quot;times new roman&quot;; mso-ascii-font-family: &quot;times new roman&quot;; mso-fareast-language: zh-tw; mso-ansi-language: en-us; mso-bidi-language: ar-sa;">，通報專線：</span><span lang="EN-US" style="font-size: 12pt; font-family: &quot;times new roman&quot;,&quot;serif&quot;; color: #000000; mso-fareast-font-family: 標楷體; mso-font-kerning: 1.0pt; mso-hansi-font-family: 標楷體; mso-fareast-language: zh-tw; mso-ansi-language: en-us; mso-bidi-language: ar-sa;">02-66251166</span><span style="font-size: 12pt; font-family: 標楷體; color: #000000; mso-font-kerning: 1.0pt; mso-bidi-font-family: &quot;times new roman&quot;; mso-ascii-font-family: &quot;times new roman&quot;; mso-fareast-language: zh-tw; mso-ansi-language: en-us; mso-bidi-language: ar-sa;">轉</span><span lang="EN-US" style="font-size: 12pt; font-family: &quot;times new roman&quot;,&quot;serif&quot;; color: #000000; mso-fareast-font-family: 標楷體; mso-font-kerning: 1.0pt; mso-hansi-font-family: 標楷體; mso-fareast-language: zh-tw; mso-ansi-language: en-us; mso-bidi-language: ar-sa;">6401</span><span style="font-size: 12pt; font-family: 標楷體; color: #000000; mso-font-kerning: 1.0pt; mso-bidi-font-family: &quot;times new roman&quot;; mso-ascii-font-family: &quot;times new roman&quot;; mso-fareast-language: zh-tw; mso-ansi-language: en-us; mso-bidi-language: ar-sa;">。</span>	<span style="font-size: 12pt; font-family: 標楷體; color: #000000; mso-font-kerning: 1.0pt; mso-bidi-font-family: &quot;times new roman&quot;; mso-ascii-font-family: &quot;times new roman&quot;; mso-fareast-language: zh-tw; mso-ansi-language: en-us; mso-bidi-language: ar-sa;">為維護消費者健康與權益，衛生福利部呼籲消費者，勿自行由國外、網路或其他通路商購買該產品使用。</span>		2015-07-01	
