17號年報	Ribotyping of Vibrio parahaemolyticus lsolates obtained from food poisoning outbreaks in Taiwan	http://www.fda.gov.tw/TC/includes/GetFile.ashx?id=154&chk=B5E3D44D-A322-4C75-A61A-A39384033A9B&mid=157&name=fdContent	2014-10-07	
17號年報	市售鴨賞中保色劑及硼砂之調查	http://www.fda.gov.tw/TC/includes/GetFile.ashx?id=155&chk=43CFE881-F572-46E4-82AC-A5ADF32CB250&mid=157&name=fdContent	2014-10-07	
17號年報	Serological characterization of papaya ringspot virus isolates in Taiwan	http://www.fda.gov.tw/TC/includes/GetFile.ashx?id=156&chk=6243DC62-98F4-4ED9-94F2-0FF88ED844E1&mid=157&name=fdContent	2014-10-07	
17號年報	Development of cloned DNA probes for phytoplasma associated with loofah witches'' broom	http://www.fda.gov.tw/TC/includes/GetFile.ashx?id=157&chk=9C652F2B-7AE5-46AD-9FD3-9E5D42932907&mid=157&name=fdContent	2014-10-07	
17號年報	Supercritical fluid extraction of flavonoids from scutellariae radix	http://www.fda.gov.tw/TC/includes/GetFile.ashx?id=158&chk=7AAD9A79-34AA-423C-8F4F-38F88D62356C&mid=157&name=fdContent	2014-10-07	
17號年報	市售piroxicam 膠囊之溶離度品質調查	http://www.fda.gov.tw/TC/includes/GetFile.ashx?id=159&chk=5FEC2420-4487-440F-A076-FECBC3D09D92&mid=157&name=fdContent	2014-10-07	
16號年報	Analysis of Synthetic Drugs in Adulterated Chinese Medicine by High Performance Liquid ChromatographyElectrospray Mass Spectrometry	http://www.fda.gov.tw/TC/includes/GetFile.ashx?id=16&chk=30C2D305-CE59-44C8-814F-C1AC0C4CCFA1&mid=157&name=fdContent	2014-10-08	
17號年報	Solid-phase extraction for the determination of caffeine in traditional chinese medicinal prescriptions containing theae folium by high performance liquid chromatography	http://www.fda.gov.tw/TC/includes/GetFile.ashx?id=160&chk=70EB57CE-BA0B-4615-8516-E34235078E6A&mid=157&name=fdContent	2014-10-07	
17號年報	Studies on the determination of hydrogen peroxide and its dissipation in foods	http://www.fda.gov.tw/TC/includes/GetFile.ashx?id=161&chk=03CE47F8-E1F4-441B-A579-51F65802E1D0&mid=157&name=fdContent	2014-10-08	
17號年報	Determination of parishin, parishin B and parishin C in traditional chinese medicinal formulas by micellar electrokinetic capillary chromatography	http://www.fda.gov.tw/TC/includes/GetFile.ashx?id=162&chk=0D239E1D-766C-48DF-AEC4-06CEB8E2E27D&mid=157&name=fdContent	2014-10-07	
17號年報	Studies on analytical method for determination of fluorescent whitening agents in paper containers for food	http://www.fda.gov.tw/TC/includes/GetFile.ashx?id=163&chk=9689D124-262A-48A9-88CD-6AE492DEB31D&mid=157&name=fdContent	2014-10-08	
17號年報	Solid-Phase extraction and high performance liquid chromatographic determination of steroids adulterated In traditional chinese medicines	http://www.fda.gov.tw/TC/includes/GetFile.ashx?id=164&chk=302ED180-B6FC-4A68-A272-BC2DBA19AB90&mid=157&name=fdContent	2014-10-08	
17號年報	Identification of illegal coal tar dyes constituents in mucous cosmetics by HPLC method	http://www.fda.gov.tw/TC/includes/GetFile.ashx?id=165&chk=070E81AE-FA1B-405B-85B6-9F4D02C849C9&mid=157&name=fdContent	2014-10-08	
18號年報	市售鹹魚中著色劑之調查	http://www.fda.gov.tw/TC/includes/GetFile.ashx?id=195&chk=A19F51BF-ADE7-47D3-BDE6-93FDAC9F740F&mid=157&name=fdContent	2014-10-07	
17號年報	Analysis and confirmation of synthetic anorexics in adulterated traditional chinese medicines by high-performance capillary electrophoresis	http://www.fda.gov.tw/TC/includes/GetFile.ashx?id=166&chk=46010465-589C-43E8-943C-A568D825117B&mid=157&name=fdContent	2014-10-07	
17號年報	Simultaneous determination of complex cold medicine formulations by HPLC	http://www.fda.gov.tw/TC/includes/GetFile.ashx?id=167&chk=5FC5F5E0-2F38-49A0-A57C-F2232C7AFCB2&mid=157&name=fdContent	2014-10-08	
17號年報	Protein and amino acid profiles in natural and artificial shark fins using capillary electrophoresis	http://www.fda.gov.tw/TC/includes/GetFile.ashx?id=168&chk=BB97F870-6A4D-4ED2-9A49-98C61F4B17D1&mid=157&name=fdContent	2014-10-07	
17號年報	嬰兒奶嘴材質試驗、溶出試驗及亞硝胺之測定	http://www.fda.gov.tw/TC/includes/GetFile.ashx?id=169&chk=E5FB7042-463A-4ABE-B9B6-201198F38153&mid=157&name=fdContent	2014-10-07	
16號年報	Evaluation of Isotopic Analogs as Internal Standard for Quantitative Determination of Urinary 6-Acetylmorphine by Gas ChromatographyMass Spectrometry	http://www.fda.gov.tw/TC/includes/GetFile.ashx?id=17&chk=2748DDDE-28F8-4045-AD92-B5ADFEF03297&mid=157&name=fdContent	2014-10-08	
17號年報	以石墨爐式原子吸收光譜儀直接測量酒中鉛、銅及鎘方法之探討	http://www.fda.gov.tw/TC/includes/GetFile.ashx?id=170&chk=E4964B94-995E-4BEF-A1CF-044CE7CE8EBC&mid=157&name=fdContent	2014-10-07	
17號年報	Determination of xanthine bronchodilators in adulterated chinese herbal preparations by high performance liquid chromatography	http://www.fda.gov.tw/TC/includes/GetFile.ashx?id=171&chk=42F18B3B-2F2F-49E2-B2D8-52110A41F724&mid=157&name=fdContent	2014-10-07	
17號年報	Determination of polar constituents of scrophulariae ranix in Bai-He-Gu-Jin-Tang by micellar electrokinetic capillary chromatography	http://www.fda.gov.tw/TC/includes/GetFile.ashx?id=172&chk=F2BA1C11-0128-4A4D-90CA-BFE882619C25&mid=157&name=fdContent	2014-10-07	
17號年報	Rapid differentiation of BCG vaccine from M. smegmatis by genomic amplification	http://www.fda.gov.tw/TC/includes/GetFile.ashx?id=173&chk=30A8DC91-F938-4C9E-94AE-15FED7813AD2&mid=157&name=fdContent	2014-10-08	
18號年報	Determination of Copper in Edible Oils by Direct Graphite Furnace Atomic Absorption Spectrometry	http://www.fda.gov.tw/TC/includes/GetFile.ashx?id=174&chk=AC3F4A21-39CF-4FB3-A3C9-542723F762FA&mid=157&name=fdContent	2014-10-07	
18號年報	食米中重屬（鎘、汞）含量之調查	http://www.fda.gov.tw/TC/includes/GetFile.ashx?id=175&chk=79B372B9-E881-4276-B2F1-F56C99A73420&mid=157&name=fdContent	2014-10-07	
18號年報	Detection of Mycotoxin Patulin in Apple Juice	http://www.fda.gov.tw/TC/includes/GetFile.ashx?id=176&chk=B2D8B8DD-5493-4A86-83F1-1E0EB5F41ECA&mid=157&name=fdContent	2014-10-07	
18號年報	The Relationship between the Cold Chain System and Vaccine Potency in Taiwan: (II) Oral Polio Vaccine	http://www.fda.gov.tw/TC/includes/GetFile.ashx?id=177&chk=EEF4BADE-C1D7-4E42-8282-4D28987CD6E2&mid=157&name=fdContent	2014-10-07	
18號年報	農產品中得拉松殘留量檢驗方法之探討	http://www.fda.gov.tw/TC/includes/GetFile.ashx?id=178&chk=BCD38BE0-A67A-4C3A-BF8A-B3D600C76628&mid=157&name=fdContent	2014-10-07	
18號年報	Determination of Butocarboxim Residue in Agricultural Products by HPLC with Post-Column Derivatization System	http://www.fda.gov.tw/TC/includes/GetFile.ashx?id=179&chk=385DF68C-1B66-4B1B-BF0C-F1E518C487A4&mid=157&name=fdContent	2014-10-07	
16號年報	Determination of Polar Constituents in Scrophulariae Radix by Micellar Electrokinetic Capillary Chromatography	http://www.fda.gov.tw/TC/includes/GetFile.ashx?id=18&chk=DF2C492D-068C-40D9-9B49-D6A60F60743B&mid=157&name=fdContent	2014-10-08	
18號年報	The Relationship between the Cold Chain System and Vaccine Potency in Taiwan: (I) Live Measles Vaccine and MMR Vaccine	http://www.fda.gov.tw/TC/includes/GetFile.ashx?id=180&chk=AE42F2C6-B40B-47B2-B389-786E92BF4039&mid=157&name=fdContent	2014-10-07	
18號年報	Determination of Amitraz Residue in Fruits by High Performance Liquid Chromatography	http://www.fda.gov.tw/TC/includes/GetFile.ashx?id=181&chk=5ACB8F87-E136-491A-B0EA-C3F37FC8A38B&mid=157&name=fdContent	2014-10-07	
18號年報	中藥材品質調查(Ⅲ)	http://www.fda.gov.tw/TC/includes/GetFile.ashx?id=182&chk=CBFE2CCD-E26F-4E12-855B-E7F29D267905&mid=157&name=fdContent	2014-10-07	
18號年報	市售雞蛋、鴨蛋及皮蛋重金屬（鉛、銅）含量調查	http://www.fda.gov.tw/TC/includes/GetFile.ashx?id=183&chk=7FD04AA1-E15A-4FC4-9130-43FA486C99D9&mid=157&name=fdContent	2014-10-07	
18號年報	市售雞肝及豬肝中有機磷劑殘留量之調查	http://www.fda.gov.tw/TC/includes/GetFile.ashx?id=184&chk=9972F562-42A6-43BA-8D4F-7925965E5D9B&mid=157&name=fdContent	2014-10-07	
18號年報	中部地區連鎖專賣店冰品飲料之衛生調查	http://www.fda.gov.tw/TC/includes/GetFile.ashx?id=185&chk=41F8F548-F14E-4D7F-BA13-A7BCBB8A17B6&mid=157&name=fdContent	2014-10-07	
18號年報	乳品中仙人掌桿菌、金黃色葡萄球菌及沙門氏桿菌污染之調查	http://www.fda.gov.tw/TC/includes/GetFile.ashx?id=186&chk=0EE6B7C8-5734-4B89-885E-BD0DF3D0D29E&mid=157&name=fdContent	2014-10-07	
18號年報	發泡聚苯乙烯紙及發泡聚苯乙烯食品容器之衛生安全調查	http://www.fda.gov.tw/TC/includes/GetFile.ashx?id=187&chk=D1829EE9-F151-45C8-88ED-BDD6443653D6&mid=157&name=fdContent	2014-10-07	
18號年報	農產品中益多松殘留量檢驗方法之建立	http://www.fda.gov.tw/TC/includes/GetFile.ashx?id=188&chk=E4F33C29-B909-4C62-816D-1B963E4DFD07&mid=157&name=fdContent	2014-10-07	
18號年報	Solid-Phase Extraction and Gas Chromatography-Mass Spectrometry Analysis of 11-Nor-9-carboxy-Δ9-tetrahydro-cannabinol in Urine for Monitoring Marijuana Abuse	http://www.fda.gov.tw/TC/includes/GetFile.ashx?id=189&chk=DFDF620B-FBE1-4FB3-A450-77AF8ADA9FB6&mid=157&name=fdContent	2014-10-07	
16號年報	Molecular Differentiation of Atractylodes Drugs by PCR-Restriction Fragment Length Polymorphism and PCR-Selective Restriction Analysis on the 18S-5.8S rDNA Intratranscribed Spacer l Gene	http://www.fda.gov.tw/TC/includes/GetFile.ashx?id=19&chk=8D122E36-475D-4528-9523-29F01E43ED2B&mid=157&name=fdContent	2014-10-08	
18號年報	八十八年度市售蔬果農藥殘留監測	http://www.fda.gov.tw/TC/includes/GetFile.ashx?id=190&chk=7BD1B4F2-6207-48AC-A51B-D5F81BB35C16&mid=157&name=fdContent	2014-10-07	
18號年報	中部地區連鎖專賣店冰品飲料之衛生調查	http://www.fda.gov.tw/TC/includes/GetFile.ashx?id=191&chk=CD126012-294A-446B-868F-08282EE7BA62&mid=157&name=fdContent	2014-10-07	
18號年報	台灣市售大薊、小薊之鑑別	http://www.fda.gov.tw/TC/includes/GetFile.ashx?id=192&chk=836AC7F3-12AE-46EF-B147-57E5B89C5B08&mid=157&name=fdContent	2014-10-07	
18號年報	Recombinant protein composed of Pseudomonas exotoxin A, outer membrane proteins I and F as vaccine against P. aeruginosa infection	http://www.fda.gov.tw/TC/includes/GetFile.ashx?id=193&chk=F0C4B2A1-77CB-4AFC-B108-048101D44361&mid=157&name=fdContent	2014-10-07	
18號年報	廣告類中藥製劑之品質調查-保肝、補腎滋養類	http://www.fda.gov.tw/TC/includes/GetFile.ashx?id=194&chk=FF295D9C-AF61-436E-B329-DFAAB8AF4C7D&mid=157&name=fdContent	2014-10-07	
18號年報	八十八年度調製劑中藥檢出西藥情形之分析	http://www.fda.gov.tw/TC/includes/GetFile.ashx?id=196&chk=11F24DC5-1F0E-4C66-BED8-7B315637EE13&mid=157&name=fdContent	2014-10-07	
18號年報	民國七十五~八十八年市售藥用酵素製劑之品質調查	http://www.fda.gov.tw/TC/includes/GetFile.ashx?id=197&chk=0C145ED2-7187-48D2-81CD-A89A9FEC7642&mid=157&name=fdContent	2014-10-07	
18號年報	醫院用及市售環氧乙烯滅菌紗布及棉花無菌性調查	http://www.fda.gov.tw/TC/includes/GetFile.ashx?id=198&chk=6D990A8A-4F41-4C28-8DFB-0EADEF23E9D3&mid=157&name=fdContent	2014-10-07	
18號年報	大型輸注液（葡萄糖溶液）之熱原試驗	http://www.fda.gov.tw/TC/includes/GetFile.ashx?id=199&chk=0D580982-7EB8-4FBA-86FA-97D2B76235B6&mid=157&name=fdContent	2014-10-07	
16號年報	市售Metronidazole錠劑之溶離度品質調查	http://www.fda.gov.tw/TC/includes/GetFile.ashx?id=2&chk=A903DD12-A0C7-4BF0-9DF3-BB3D5F780174&mid=157&name=fdContent	2014-10-08	
16號年報	雞肉及雞肝中動物用藥安保寧(amprolium)殘留量檢驗方法之探討	http://www.fda.gov.tw/TC/includes/GetFile.ashx?id=20&chk=B402E350-738C-4A4E-AC0C-2C9A02EEB9F1&mid=157&name=fdContent	2014-10-08	
18號年報	市售Dexamethasone錠劑之品質調查	http://www.fda.gov.tw/TC/includes/GetFile.ashx?id=200&chk=4243AF21-52DD-43F0-9864-D9BE8B1982CE&mid=157&name=fdContent	2014-10-07	
18號年報	Phenytoin製劑之溶離曲線試驗	http://www.fda.gov.tw/TC/includes/GetFile.ashx?id=201&chk=5D8104E5-1208-4AB0-80D2-BF11CAD0E67D&mid=157&name=fdContent	2014-10-07	
18號年報	市售Astemizole 錠劑之品質調查	http://www.fda.gov.tw/TC/includes/GetFile.ashx?id=202&chk=F2D36299-FFA7-44EA-8231-21392BDDA210&mid=157&name=fdContent	2014-10-07	
18號年報	市售衛生套針孔試驗及含局部麻醉劑之品質調查	http://www.fda.gov.tw/TC/includes/GetFile.ashx?id=203&chk=4B36D30F-812C-4A9D-8CF9-67FED7D4CBFA&mid=157&name=fdContent	2014-10-07	
18號年報	市售防曬化妝品品質調查	http://www.fda.gov.tw/TC/includes/GetFile.ashx?id=204&chk=09714AC6-B646-4C4C-9286-3C84B942F7C1&mid=157&name=fdContent	2014-10-07	
18號年報	藥物食品檢驗局第十八號調查研究年報	http://www.fda.gov.tw/TC/includes/GetFile.ashx?id=205&chk=CAEA3340-AD9A-4BE7-8DBE-AEFA0CBCB4B7&mid=157&name=fdContent	2014-10-07	
18號年報	藥物食品檢驗局第十八號調查研究年報	http://www.fda.gov.tw/TC/includes/GetFile.ashx?id=206&chk=57EBF5A5-2C1D-4208-9B9F-9E817CC8F25D&mid=157&name=fdContent	2014-10-07	
18號年報	台灣市售白頭翁藥材之鑑別	http://www.fda.gov.tw/TC/includes/GetFile.ashx?id=207&chk=7D240387-9140-4C4F-AA9C-D6C385D85BEC&mid=157&name=fdContent	2014-10-07	
18號年報	O157型大腸桿菌商業化檢測套組之評估	http://www.fda.gov.tw/TC/includes/GetFile.ashx?id=208&chk=0C1E3539-DC39-4763-8F06-D908D257A134&mid=157&name=fdContent	2014-10-07	
18號年報	Flavonoids from the leaves of Loranthus Kaoi (Chao) Kiu	http://www.fda.gov.tw/TC/includes/GetFile.ashx?id=209&chk=FD8893BD-B3DB-4F53-8564-EDA137216106&mid=157&name=fdContent	2014-10-07	
16號年報	雞肉檢體中沙門氏桿菌快速檢驗方法之探討	http://www.fda.gov.tw/TC/includes/GetFile.ashx?id=21&chk=A668D14B-775C-40A0-BA06-A6942D33392B&mid=157&name=fdContent	2014-10-08	
18號年報	市售即食食品中金黃色葡萄球菌及其腸毒素、沙門氏桿菌、仙人掌桿菌之檢驗	http://www.fda.gov.tw/TC/includes/GetFile.ashx?id=210&chk=7ABACBDB-D0C8-44FC-A44D-9B59EF58D79A&mid=157&name=fdContent	2014-10-07	
18號年報	八十八年度國產及進口香菸中尼古丁及焦油含量調查	http://www.fda.gov.tw/TC/includes/GetFile.ashx?id=211&chk=0BF723A6-20A1-442F-A5C8-B85F1DFEFCF4&mid=157&name=fdContent	2014-10-07	
18號年報	以PCR及多位點酵素分析法探討自台灣地區分離之O157型大腸桿菌特性	http://www.fda.gov.tw/TC/includes/GetFile.ashx?id=212&chk=6E154ABF-C3EB-43D0-A6B3-4C39F24A2CF3&mid=157&name=fdContent	2014-10-07	
18號年報	Protease and amylase production of Streptomyces rimosus in submerged and solid state cultivations	http://www.fda.gov.tw/TC/includes/GetFile.ashx?id=213&chk=5CC25794-438F-4BC7-A39F-F8AD273B9E48&mid=157&name=fdContent	2014-10-07	
18號年報	本土Shiga毒素產生性大腸桿菌(STEC)之特性及其遺傳關係	http://www.fda.gov.tw/TC/includes/GetFile.ashx?id=214&chk=D82BA665-9BCB-4336-898F-4B844C942027&mid=157&name=fdContent	2014-10-07	
18號年報	本土Shiga毒素產生性大腸桿菌(STEC)之分離	http://www.fda.gov.tw/TC/includes/GetFile.ashx?id=215&chk=3FDFCE71-95B9-41AA-B715-33CB19D9DFA6&mid=157&name=fdContent	2014-10-07	
18號年報	市售Salmonella快速檢測套組之評估	http://www.fda.gov.tw/TC/includes/GetFile.ashx?id=216&chk=970613F4-FF30-45AE-B703-60B872FC264C&mid=157&name=fdContent	2014-10-07	
18號年報	已聚合鏈鎖反應法檢測Salmonella spp	http://www.fda.gov.tw/TC/includes/GetFile.ashx?id=217&chk=2B19A577-72E2-407A-B0DA-4601BD22C4BE&mid=157&name=fdContent	2014-10-07	
18號年報	農產品中益多松殘留量檢驗方法之探討	http://www.fda.gov.tw/TC/includes/GetFile.ashx?id=218&chk=E813C5FA-C881-4493-8645-CDF6ED08D602&mid=157&name=fdContent	2014-10-07	
18號年報	農產品中得拉松殘留量檢驗方法之探討	http://www.fda.gov.tw/TC/includes/GetFile.ashx?id=219&chk=85D26FF6-5CB3-4841-A8D1-9BA466A016D7&mid=157&name=fdContent	2014-10-07	
16號年報	牛肉、豬肉暨雞肉中甲磺氯黴素之殘留分析	http://www.fda.gov.tw/TC/includes/GetFile.ashx?id=22&chk=2B4890BB-7262-4611-ACF8-4E89243B5BD3&mid=157&name=fdContent	2014-10-08	
18號年報	保健食品中脂肪酸百分組成檢驗方法之探討	http://www.fda.gov.tw/TC/includes/GetFile.ashx?id=220&chk=ADE7827C-2F8E-4848-83CE-BF12D6C0BC1C&mid=157&name=fdContent	2014-10-07	
18號年報	Evaluation on The Potency Assay System of Live Rubella Virus Vaccine	http://www.fda.gov.tw/TC/includes/GetFile.ashx?id=221&chk=504EE7F6-B010-4119-9728-E0AB68CF0733&mid=157&name=fdContent	2014-10-07	
18號年報	金黃色葡萄球菌及其腸毒素在84-88年度食品中毒檢體中之分佈	http://www.fda.gov.tw/TC/includes/GetFile.ashx?id=222&chk=FB3C774A-07E8-4BB9-80B6-1CD9C82FC037&mid=157&name=fdContent	2014-10-07	
18號年報	畜產肉品中 Clenbuterol 殘留量檢驗方法之探討	http://www.fda.gov.tw/TC/includes/GetFile.ashx?id=223&chk=F0EE595B-C93F-4789-B5F4-A690D1ED18AF&mid=157&name=fdContent	2014-10-07	
18號年報	Analysis of Synthetic Gastrointestinal Drugs in Adulterated Traditional Chinese Medicines by High-Performance Capillary Electrophoresis	http://www.fda.gov.tw/TC/includes/GetFile.ashx?id=224&chk=1C3AC5D4-3F4B-4D88-90F8-A4EA043359A2&mid=157&name=fdContent	2014-10-07	
18號年報	The Study of Mumps Vaccine Potency of Combined Live Measles, Mumps, and Rubella (MMR)Vaccine in Taiwan	http://www.fda.gov.tw/TC/includes/GetFile.ashx?id=225&chk=AC0B4595-E1AF-4FD3-A054-6A6F0ADC5E93&mid=157&name=fdContent	2014-10-07	
18號年報	Identification of Antelope Horn in Chinese Medicine Preparations by Restriction Site Patterns of PCR Amplified Mitochondrial DNA	http://www.fda.gov.tw/TC/includes/GetFile.ashx?id=226&chk=9468780F-2803-4E64-926F-4D7E6D5F0198&mid=157&name=fdContent	2014-10-07	
18號年報	甘遂藥材中Triterpenoid 成分之分離及氣相層析質譜儀定量研究	http://www.fda.gov.tw/TC/includes/GetFile.ashx?id=227&chk=22AE9277-A61E-48DC-B785-6AE0ACEF9D9B&mid=157&name=fdContent	2014-10-07	
18號年報	中藥製劑中摻加西藥成分之高效液相層析及毛細管電泳研究	http://www.fda.gov.tw/TC/includes/GetFile.ashx?id=228&chk=BCD19A91-8DCC-4807-A16F-749BA47DCC54&mid=157&name=fdContent	2014-10-07	
18號年報	以PCR方法檢測基因改良大豆及玉米	http://www.fda.gov.tw/TC/includes/GetFile.ashx?id=229&chk=B0C583ED-3AD4-4DE0-898D-702F70D1E7E9&mid=157&name=fdContent	2014-10-07	
16號年報	魷魚乾中膽固醇氧化產物之分析	http://www.fda.gov.tw/TC/includes/GetFile.ashx?id=23&chk=B6A88A3E-70E3-4E1F-B8D9-96BE32CB0318&mid=157&name=fdContent	2014-10-08	
18號年報	應用Multiplex PCR檢測金黃色葡萄球菌腸毒素	http://www.fda.gov.tw/TC/includes/GetFile.ashx?id=230&chk=A812BB00-CBAF-47EB-A0C5-9A93AFBC78C2&mid=157&name=fdContent	2014-10-07	
18號年報	市售具營養宣稱之包裝食品中膳食纖維含量之調查	http://www.fda.gov.tw/TC/includes/GetFile.ashx?id=231&chk=99CDFD01-7688-42D8-A5E3-B2A8850EF5EF&mid=157&name=fdContent	2014-10-07	
18號年報	以高效液相層析法建立雞肉及豬肉中動物用藥之多重殘留檢驗方法	http://www.fda.gov.tw/TC/includes/GetFile.ashx?id=232&chk=80A1E422-5700-4F6E-8E89-B184E5E6B5AA&mid=157&name=fdContent	2014-10-07	
18號年報	Analysis of Flavonoids and Coumarins in Ixeris Laevigata Var. Oldhami by High-Performance Liquid Chromatography	http://www.fda.gov.tw/TC/includes/GetFile.ashx?id=233&chk=AB54F7B3-15B0-4754-940D-5DD6125C1C79&mid=157&name=fdContent	2014-10-07	
19號年報	Determination of Arsenic in Edible Fats and Oils by Focused Microwave Digestion and Atomic Fluorescence Spectrometer	http://www.fda.gov.tw/TC/includes/GetFile.ashx?id=234&chk=30F795A3-CA1A-4D27-B1D7-FB305FE17993&mid=157&name=fdContent	2014-10-07	
19號年報	GC-MS Analysis on Anorectics Adulterated in Traditional Chinese Medicines	http://www.fda.gov.tw/TC/includes/GetFile.ashx?id=235&chk=C98F8F0D-E7C3-48DB-A54E-E221CF81ACA6&mid=157&name=fdContent	2014-10-07	
19號年報	常用藥膳食品中仙人掌桿菌之檢驗	http://www.fda.gov.tw/TC/includes/GetFile.ashx?id=236&chk=93F65622-AEA1-4E67-8CDB-8F2357B250F3&mid=157&name=fdContent	2014-10-07	
19號年報	Detection of Genetically Modified Soybeans and Maize by the Polymerase Chain Reaction Method	http://www.fda.gov.tw/TC/includes/GetFile.ashx?id=237&chk=D9C7DECC-D4A6-4F25-8391-5102A604EC80&mid=157&name=fdContent	2014-10-07	
19號年報	A Rapid and Simple Method for the Determination of Ethephon Residue in Agicultural Products by GC with Headspace Sampling	http://www.fda.gov.tw/TC/includes/GetFile.ashx?id=238&chk=0678D622-6E31-43E7-9C74-2632481F8063&mid=157&name=fdContent	2014-10-07	
19號年報	The Turnover Rate of Marker Constituents in Chinese Herbal Medicine	http://www.fda.gov.tw/TC/includes/GetFile.ashx?id=239&chk=7C29DE17-FDC2-4312-9B78-3087DDED6F5E&mid=157&name=fdContent	2014-10-07	
16號年報	Three Dimension Morphology of Clostridium botulinum by Atomic Force Microscope	http://www.fda.gov.tw/TC/includes/GetFile.ashx?id=24&chk=BF66F1E5-50C5-4B3F-885C-C47D84C07DB9&mid=157&name=fdContent	2014-10-08	
19號年報	Preparative Isolation and Gas Chromatography-Mass Spectrometry Analysis of Triterpenoids in Kansui Radix	http://www.fda.gov.tw/TC/includes/GetFile.ashx?id=240&chk=36ED8EFC-7CDB-442D-8F99-98B90985B95D&mid=157&name=fdContent	2014-10-07	
19號年報	Evaluation of Quantitative Analysis of Flavonoid Aglycones in Ginkgo biloba Extract and its Products	http://www.fda.gov.tw/TC/includes/GetFile.ashx?id=241&chk=E5CCC35B-B9A2-4685-B066-80F9DFC44429&mid=157&name=fdContent	2014-10-07	
19號年報	Determination of Flavonoide in Daphnis Genkwae Flos by High Performance Liquid Chromatography	http://www.fda.gov.tw/TC/includes/GetFile.ashx?id=242&chk=A0D0A9FB-2530-4F76-86EE-6FA65A4E43A2&mid=157&name=fdContent	2014-10-07	
19號年報	Isolation and Cytotoxicity of Flavonoids from Daphnis Genkwae Flos	http://www.fda.gov.tw/TC/includes/GetFile.ashx?id=243&chk=2F349C56-DDD0-4419-ADB2-0F41DDD2461A&mid=157&name=fdContent	2014-10-07	
19號年報	Characterization of Escherichia coli Serotype O157 Strains Isolated in Taiwan by PCR and Multilocus Enzyme Analysis	http://www.fda.gov.tw/TC/includes/GetFile.ashx?id=244&chk=94219D1F-7BD5-4F18-B510-73A49F6ABDFC&mid=157&name=fdContent	2014-10-07	
19號年報	The Sterility Survey of Ethylene Oxide Sterilized Gauzes and Cotton in Taiwan	http://www.fda.gov.tw/TC/includes/GetFile.ashx?id=245&chk=DA4669BD-07B4-48A3-949F-305D0D1E4D24&mid=157&name=fdContent	2014-10-07	
19號年報	High Performance Chromatographic Determination of Asulam Residue in Agricultural Products	http://www.fda.gov.tw/TC/includes/GetFile.ashx?id=246&chk=3DC8DAC9-72B1-45FF-BE2B-90441723DCF9&mid=157&name=fdContent	2014-10-07	
19號年報	Multiresidue Determination of Veterinary Drugs in Chicken and Swine Muscies by High Performance Liquid Chromatography	http://www.fda.gov.tw/TC/includes/GetFile.ashx?id=247&chk=E563ACD6-E675-44D1-A25E-7303935CA16C&mid=157&name=fdContent	2014-10-07	
19號年報	應用PCR-RFLP 技術建立金黃色葡萄球菌凝固酵素分型方法	http://www.fda.gov.tw/TC/includes/GetFile.ashx?id=248&chk=BE3EB813-7EDA-43E2-826D-57FAC436A7A7&mid=157&name=fdContent	2014-10-07	
19號年報	Detection of Four Types of Genetically Modified Maize by Polymerase Chain Reaction and Immuno-Kit Methods	http://www.fda.gov.tw/TC/includes/GetFile.ashx?id=249&chk=C94628DF-F993-4933-BD80-B030CEC163ED&mid=157&name=fdContent	2014-10-07	
16號年報	青花菜中達馬松及加保扶於冷凍加工之消減	http://www.fda.gov.tw/TC/includes/GetFile.ashx?id=25&chk=E995F8E4-812B-4E35-9891-B194CF5A8FCA&mid=157&name=fdContent	2014-10-08	
19號年報	Transformation of Ginsenosides Rg1 and Rb1 ,and Crude Sanchi Saponins by Human Intestinal Microflora	http://www.fda.gov.tw/TC/includes/GetFile.ashx?id=250&chk=3998F9DD-332B-497C-B711-A2849C32F23A&mid=157&name=fdContent	2014-10-07	
19號年報	八十八年下半年及八十九年度調製劑中藥檢出西藥情形之分析	http://www.fda.gov.tw/TC/includes/GetFile.ashx?id=251&chk=405C4AB8-C702-42D7-BDEA-958AAD9C0570&mid=157&name=fdContent	2014-10-07	
19號年報	市售蔬果殘留量農藥監測	http://www.fda.gov.tw/TC/includes/GetFile.ashx?id=252&chk=8DBFB2B4-8278-421C-8B95-719E997943D9&mid=157&name=fdContent	2014-10-07	
19號年報	八十八下半年及八十九年度國產及進口香菸中尼古丁及焦油含量調查	http://www.fda.gov.tw/TC/includes/GetFile.ashx?id=253&chk=FAE2A319-673E-4537-A894-66CA077B20E6&mid=157&name=fdContent	2014-10-07	
19號年報	市售保健食品中膳食纖維含量之調查	http://www.fda.gov.tw/TC/includes/GetFile.ashx?id=254&chk=44121487-023E-4615-96CD-EB09E09B8A35&mid=157&name=fdContent	2014-10-07	
19號年報	市售具營養宣稱之包裝食品中膳食纖維含量之調查	http://www.fda.gov.tw/TC/includes/GetFile.ashx?id=255&chk=922C265F-FCD1-44E4-862E-EF0E9ED6D44C&mid=157&name=fdContent	2014-10-07	
19號年報	市售化粧品中Salicylic Acid 成分之含量調查	http://www.fda.gov.tw/TC/includes/GetFile.ashx?id=256&chk=19217F50-6139-4E6B-BA5B-C7DEB8676271&mid=157&name=fdContent	2014-10-07	
19號年報	面霜中Tretinoin成分之調查	http://www.fda.gov.tw/TC/includes/GetFile.ashx?id=257&chk=DD50BBC8-8922-4206-9101-E7D8103D5FCC&mid=157&name=fdContent	2014-10-07	
19號年報	The Contents of Parishin, Parishin B and C in Traditional Decoctions and Commercial Herbal Extracts of Gastrodiae Rhizoma	http://www.fda.gov.tw/TC/includes/GetFile.ashx?id=258&chk=1D4DF904-8A4F-47E2-AF03-B112EDF09E94&mid=157&name=fdContent	2014-10-07	
19號年報	台灣東部地區過貓、山蘇、麵包果農藥殘留量調查	http://www.fda.gov.tw/TC/includes/GetFile.ashx?id=259&chk=14E52249-6168-40FD-AC79-FAD6770CD401&mid=157&name=fdContent	2014-10-07	
